id,fold,label,target,text
lidong-train-5173,0,pos,wii,well ... got my wii to play super smash brothers brawl ... for 3 minutes . i got it christmas of 08 and the game wo n't work experience
lidong-train-3325,1,pos,britney spears,"my house mate does n't believe i just kissed britney spears incredible ! so , would you like to ?"
lidong-train-5740,2,neg,iphone,"very annoying that iphone corrects '' says '' to '' sex . '' everytime i fail to catch , i send a goofy message . sometimes worse than goofy ."
lidong-test-581,3,pos,britney spears,"Honestly honestly , Gim me More is one of my favorite britney spears video ... i just love the whole concept of it ... as well as the coloring ."
lidong-train-3209,4,pos,justin bieber,I 'm watching Never Say Never by justin bieber ft . Jaden Smith on VEVO for phone . . two brothers supporting each other
lidong-train-3025,5,pos,demi lovato,OMG demi lovato interview is just so intense . She may have been really strong to tell her story . But we are all so thankful . congratulations Demi .
lidong-train-3397,6,pos,john mayer,"Listening to Free Falling by john mayer , i love this song : )"
lidong-train-5885,7,pos,justin bieber,"38 . I want to sing with justin bieber one day . Yes , I sing better than R . Hitam . ( : 100factsaboutme"
lidong-train-881,8,pos,windows 7,windows 7 is the best non-unix based os i have ever used . you should be very happy together .
lidong-train-4259,9,neu,sarah palin,"To compete with sarah palin , Joel Stein wrote his autobio in a single day endlessly awesome"
lidong-train-920,0,neg,obama,President obama is Trap ! He and his Nato Allies got in the Middle of the Libya crisis with no way Out ! TRAPFILES . COM
lidong-train-2089,1,pos,harry potter,"t is our choices ... that show what we truly are , far more than our abilities . - J . ok . Rowling ( harry potter and The Chamber of Secrets )"
lidong-train-1363,2,neu,harry potter,We 're at chapter 14 in harry potter 1 . And I really feel like the kids should have gone to Dumbledore sooner !! Yikes ! . .
lidong-train-2043,3,neu,barack obama,Obama 's national security team weighs options on 8th anniversary ... : President barack obama and first lady . .
lidong-train-3372,4,neg,lindsay lohan,if you feather your bleached blonde hair to look like farrah fawcett than you 're too old to wear an outfit to look like lindsay lohan .
lidong-train-1377,5,pos,barack obama,"i love michael jackson because he 's a legend , barack obama because he 's inspirational , and my mom because she'a a celeb to me ."
lidong-train-5569,6,pos,ipod,got me singing like nana na na everyday like my ipod stuck on replay . just got ta do worked sited & power point . i hate this class !
lidong-test-243,7,neu,lindsay lohan,"star : lindsay lohan hits rock bottom , is `` obituary waiting to happen ''"
lidong-train-3624,8,neg,lakers,lol sheesh lol RT KiaaMoniquee : i see them laker HATERS are back ! -- > inibbleonclits Fuck the lakers LOL . . Teamceltics
lidong-train-4817,9,pos,windows 7,i 'm surprised by how useful the windows 7 thing where windows resize themselves to half the width of the screen is . i 'd go as far as '' handy ''
lidong-train-4036,0,neg,lindsay lohan,'' mr. lindsay lohan ' s daddy '' is a fame whore !
lidong-train-502,1,neu,barack obama,"If you 're walking down the right path and you 're willing to keep walking , eventually you 'll make progress . barack obama"
lidong-train-4006,2,neu,perez hilton,"perez hilton >> Knock Knock , It 's Wal-Mart At Your Door : Is this a good or bad thing ? We do n't know yet , but i ... ."
lidong-train-5446,3,neu,micheal jackson,"Real talk She micheal jackson bad , I 'm attracted to her , with her attractive ass ... whats the name of that song"
lidong-train-6194,4,neu,harry potter,is it weird that i 've had multiple dreams about being harry potter ?
lidong-train-4567,5,neu,harry potter,"If harry potter ' is so damn magical , why the heck ca n't he cure his eyesight ?"
lidong-train-4193,6,pos,mariah carey,Breaking news : dembabies are on their way ... congratulations to mom mariah carey and daddy Nick Cannon
lidong-test-477,7,pos,google wave,google wave looks interesting for educational uses !
lidong-test-249,8,pos,martha stewart,martha stewart Crafts Peg Stamp Starter Kit : martha stewart Crafts Peg Stamp Starter Kit Create elegant wreaths ... .
lidong-train-2751,9,neu,barack obama,barack obama ' is peace prize starts a fight
lidong-train-5424,0,neg,lady gaga,TeamLaylaa sorry . i hate lady gaga so much that she infests my brain sometimes .
lidong-train-5757,1,pos,katy perry,I don care what anyone says i think katy perry has a great voice !
lidong-train-4870,2,neu,lindsay lohan,interviewed lindsay lohan earlier today . her lips were looking big . like swollen big . but she was surprisingly kinda cool .
lidong-test-645,3,pos,taylor swift,"I hate when people think its weird that I listen to taylor swift , paramore , or anything pop & rock ... am I not a pop & rock type a chick ?"
lidong-train-5539,4,neu,windows 7,windows 7 upgrade scenarios : scenario 4 : upgrade from the windows 7 rc to the final version
lidong-train-4654,5,neu,britney spears,musicmonday britney spears - heaven on earth
lidong-train-1984,6,neg,john boehner,IfGovernmentShutsDown Arrest john boehner and Eric Cantor and abolish the Tea Party !!!!
lidong-train-1595,7,neu,google wave,i am on google wave . i am so much better than you .
lidong-train-934,8,neu,lady gaga,Glee Extended Tonight For lady gaga Born this Way Episode ( Recap ) : On Tuesday Glee Extended Ton ... .
lidong-train-4568,9,neg,nick jonas,"The awkward moment when Rebecca Black actually thinks nick jonas likes her song , when he 's really just making fun of her . thatwasawkward"
lidong-train-1266,0,neu,kindle,no . kindle is a dream platform . like itunes / pod . i ca n't get into them
lidong-train-2189,1,pos,demi lovato,i love demi lovato KATY PERRY SELENA GOMEZ LADY gag MILEY CYRUS AND THE BIG BIG love TAYLOR SWIFT
lidong-train-5730,2,neu,kindle,"okay , thanks ! hopefully i can download it to kindle ."
lidong-train-5388,3,neg,iphone,pissed now . the droid rapes the iphone . by far . thank you lack of patience .
lidong-train-1875,4,neu,lindsay lohan,lindsay lohan photos & pictures | is life unfair for lindsay ?
lidong-test-246,5,neu,ipad,"Love 4.2 on my ipad , but not sold on the silent switch . I preferred it as a orientation lock ."
lidong-train-2820,6,neg,sarah palin,Not hardly ! ( Somehow '' going rogue '' and sarah palin conjures all kinds of unpleasant images . )
lidong-train-5159,7,neu,jimmy fallon,Live from New York ! jimmy fallon loves the Long Island University Blackbirds .
lidong-train-4597,8,pos,ipad,"ngmoco I love to play from my ipad !!! But if it 's not available or I 'm too lazy to carry it in bed , it 's my phone"
lidong-train-4250,9,neu,barack obama,"oh yeah we saw a boy in uni today who might have been barack obama . me , llinosd and samsamsammie screeched"
lidong-train-4631,0,neu,lady gaga,lady gaga ( lady gaga ) taunted by burgers . celebrity
lidong-train-3039,1,neu,harry potter,reaaaaalllly love your acting in harry potter ! Why do n't you come to Korea ? ㅠㅠ
lidong-train-5638,2,neu,harry potter,home from work !! has had a good day !! but was long ! gon na chill out and watch harry potter and the philiosophers stone !! happy days !! : )
lidong-train-6234,3,neu,madonna,Do n't confuse fame with success . madonna is one ; Helen Keller is the other . 882 people liked this !
lidong-train-2853,4,pos,justin timberlake,"Perfect Couples : Britney Spears and justin timberlake , ahh those where the days * thinks back *"
lidong-train-2689,5,pos,tiger woods,tiger woods : Sports ' First Billion-Dollar Man : tiger woods first athlete to break the billion-dollar ear . .
lidong-train-2101,6,pos,iphone,"well done !! just had a quick peek on my phone , off to turn on computer for a proper look . i love my iphone ; )"
lidong-test-311,7,neu,madonna,' Hes like what ? 15 and shes like 72 ' Zippy earlier today on the topic of Jesus Luz and madonna while filming the Jess and Zippy Show ...
lidong-train-3208,8,neg,lindsay lohan,omg lindsay lohan looks a mess on the cover of star . poor girl . she needs to get it together !
lidong-train-5947,9,neu,hilary swank,does anyone else think joe looks like hilary swank in boys don cry ?! just me then xfactor
lidong-train-3366,0,neu,madonna,But ... you will never to be able to call me mine . madonna . I 'm nobody 's man . Are you nobodies wife ?
lidong-train-955,1,neu,ipod,i have a magnavox clock radio that works pretty good ... and a jensen one for my ipod ... hope that helps
lidong-test-207,2,neu,britney spears,"getting to follow your celebrity life , i do n't even miss britney spears on twitter ."
lidong-train-4900,3,neg,britney spears,"john and edward did thee most shitest performance ever . britney spears , out of tune and sync both dancing and singing , funny though"
lidong-train-4579,4,neu,micheal jackson,GO GO GO JORDAN !!! oh and she 's dancing a tribute to micheal jackson . yes baby . loveeee you !
lidong-train-2113,5,pos,google,love google chat ! I get to have little convos with my husband all day !
lidong-train-2913,6,pos,iphone,got some cool new iphone cases & bt headsets . i love being on the list for this stuff .
lidong-train-5191,7,neu,psp,save $ 1.5 - crisis core : final fantasy vii $ 18.49 psp bargain ad
lidong-test-305,8,pos,justin,I love justin because he is perfect and is my inspiration believer forever ! I have a fever Bieber ! ¡ ! ¡ ! ¡
lidong-train-4521,9,pos,psp,thank you bon :) i enjoy playing around with my psp program love all beautiful colors
lidong-train-1491,0,neu,sarah palin,"Letterman Apologizes to His Wife ... and sarah palin - sarah palin , I 'm terribly , terribly sorry . So there we g ..."
lidong-train-470,1,neu,sarah palin,"Maybe Huck should have asked sarah palin for some help to meet his goal with his little petition , I hear she is pretty popular these days ."
lidong-train-480,2,neg,windows 7,"honestly , i don like it . '' windows 7 beats vista by 234 % in first week sales '' -"
lidong-train-2498,3,neu,britney spears,britboi '' britney spears '' b3p contest ends 10/20/09 ! make sure you check it out and get your entry turned in !
lidong-train-307,4,neu,jimmy carter,"nobel peace prize is for u-2 , jimmy carter , obama , and jill chaplin , md , has it for shout '' cripples ! ''"
lidong-train-4741,5,pos,justin timberlake,"beforewehadjustin , justin timberlake was the bomb . And yes , he still should be . That guy is awesome ."
lidong-train-4347,6,neu,bill gates,"`` Only through focus can you do world-class things , no matter how capable you are . '' - bill gates quote"
lidong-test-473,7,pos,justin drew bieber,he is my hero . my inspiration . he is amazing . he makes amazing music . he is super sweet . he is a ninja . his name ? justin drew bieber ♥
lidong-train-5200,8,neg,alex rodriguez,New blog post : Fake Autographs Ebay Derek Jeter Albert Pujols alex rodriguez Signed Autographed Baseball Photo .
lidong-test-493,9,pos,wii,but the wii fit is awesome ! oh we should play against each other !!
lidong-train-5256,0,neg,obama,Defend Marriage & Stop President obama 's Unconstitutional Power Grab ! . NOMtweets NO4M TCOT
lidong-train-3685,1,pos,lady gaga,What Is Your favorite lady gaga Live Performance ?
lidong-train-6110,2,neu,ipod,"i really miss my ipod , i feel so lost w/o my muzic !!"
lidong-test-525,3,pos,demi lovato,Rebecca Black looks like demi lovato .
lidong-train-3988,4,neg,madonna,says channel [ V ] playlist today : madonna . hish ! why madonna ? i hate madonna : ' - (
lidong-train-2391,5,neu,lindsay lohan,smdh lindsay lohan she got another dui . . how you get two dui less then a month ??? < - money make you do some dumb ish ! smh
lidong-train-5448,6,neg,britney spears,"meldel , britney spears suck a stick ( minha follower , olha q beleza ! ) , kkkkkkkkkkkkkkkkkkkkkkkkkkkkkkkkkkkkkkkkkkkkkkkkkkk"
lidong-test-154,7,neu,lindsay lohan,"heaven must be missing an angel ... and that angel happens to be lindsay lohan . we want the old lindsay , not that trainwreck one , back ."
lidong-test-656,8,neg,barack obama,"President Obama IS NOT a liberal . barack obama may be a liberal , but POTUS Is not ... ."
lidong-train-2076,9,neg,hilary swank,do n't want to see amelia . every time hilary swank looks like a boy she wins an oscar . - she looks like a damn boy again ! . . oscar ?
lidong-train-590,0,neu,hilary swank,"the new '' amelia '' movie looks terrible . hilary swank looks like travis_stuebing . i bet he 'd be better in it than her , though ."
lidong-train-5837,1,pos,harry potter,I love the harry potter movies ! Just saying . . NBD
lidong-train-5728,2,neg,j lo,"To all of you that love j lo and hate Lady gag ... gag is writing and producing songs for j lo 's new album , so ... SuckOnThat ; - )"
lidong-train-1476,3,neg,dave matthews,"Looks like dave matthews is in town , hope he does n't dump his shit in the Chicago river again ... It 's already nasty enough ."
lidong-train-4864,4,neg,lady gaga,Fucking Gwar was awesome im soaked in blood and guts and they killed lady gaga but im 2 drunk 2 tweet
lidong-train-3644,5,neg,hilary swank,good grief ! when did hilary swank get so old ?
lidong-train-482,6,neu,john legend,np Wake Up Everybody by john legend and The Roots Roots . They better say that
lidong-train-1259,7,neu,maradona,the marathon run against Arsenal . maradona who ? : D
lidong-train-2327,8,neu,britney spears,you have to keep all shower dances to britney spears like under body movements . fancy feet + wet tub will get you a hospital trip
lidong-test-567,9,neu,windows 7,"chess titans , windows 7 . . miss this game !!"
lidong-train-4986,0,neu,ashley tisdale,"Shit , you could of just let me loose on the High School Musical set & i 'd of been 1 happy ass dude with ashley tisdale & Vanessa Hudgens b lol"
lidong-train-1517,1,pos,google wave,"believe it or not , google wave has already proven to be sort of useful between team members"
lidong-train-2416,2,neg,serena williams,serena williams ' gimmicky '' banned '' ad .
lidong-test-114,3,neu,britney spears,you 're trying to pee & britney spears is echoing off the cubicle walls ... but you do n't hate it like you know you should . y/n .
lidong-test-223,4,neu,bill gates,bill gates ' cousin encouraged me to take a camel from Microsoft . It 's cute and sitting on my table .
lidong-train-709,5,pos,harry potter,Meeting ... Who like harry potter ? please show you hand \ \ o / / >> \ \ o / /
lidong-train-1026,6,neu,kindle,is an amazon kindle good for a 12 year old ?
lidong-train-3679,7,neu,wii,why is this likkle fool writing me a list of games he wants for his wii and psp . . he thinks because im his brother i will fork out over # 200 for him
lidong-train-4975,8,neu,larry king,larry king on Elizabeth Taylor : ' We 'll Never See the Likes of Her Again ' ( Video ) : Kimberly Nordyke The former talk ... .
lidong-train-6121,9,pos,google,this google television post reminded me of what an awesome toy the speak and spell was . LOVED IT ! .
lidong-train-5428,0,neg,lindsay lohan,really . lindsay lohan is the biggest disaster ever . you really could do better .
lidong-train-2271,1,neu,sarah palin,Obama 's Nobel Peace Prize He did maximize the distance between sarah palin and the nuclear trigger ...
lidong-train-5317,2,pos,lakers,"I love my lakers , but I 'm bored with this game . - changes the channel -"
lidong-train-186,3,neu,lady gaga,I love nikki Minaj ! She 's the black lady gaga but even better !!! I love you girrrlll
lidong-train-1522,4,neu,psp,debateing getting persona 4 or persona psp ... is the one on psp like the persona 4 ? cus 4 looks like fun .
lidong-train-1322,5,neu,britney spears,mac check this out its a britney spears mix you will love it i promise
lidong-train-4772,6,neg,steve jobs,Fake steve jobs on the IBM Air NZ fiasco
lidong-train-5397,7,pos,harry potter,i love harry potter marathons < 3
lidong-train-1572,8,neg,google,HaanaSnow no . google translate would fuck it up . XDD
lidong-train-5839,9,neu,britney spears,i do n't think there is anything . . anything i care less about than britney spears globalgrind 0_o
lidong-train-236,0,neg,anderson cooper,"There 's only one thing all these wars and tragedies havein common : anderson cooper . He 's always there first ! Katrina , before the copters !"
lidong-train-4476,1,neg,lakers,lakers ARE FUCKING HOT . .
lidong-train-2644,2,neg,justin bieber,That dude justin bieber has bitches on deck
lidong-train-507,3,neu,lady gaga,"Justin bieber , chris brown , any yo , usher , jonas brothers lady gaga , katy perry , taylor swift , kesha , alicia keys dll love you"
lidong-train-3501,4,pos,britney spears,wow congratulations to britney spears for having her new single debut 1 on billboard !!!!!!
lidong-train-4964,5,neg,britney spears,definitely . was excited to watch fat camp & dumb mtv put britney spears on
lidong-train-422,6,neu,kindle,"ugh , i 'm sorry , you need a kindle or other portable reading device , or else kindle application for phone . hate being without a book ."
lidong-train-3037,7,pos,soulja boy,"God , I pray for soulja boy 's family . As I am sure they are having sleepless nights . Hold them through this time . Give them strength ."
lidong-train-124,8,neg,lakers,Fuck the lakers LOL . . Teamceltics
lidong-train-4486,9,neu,tiger woods,golf Presidents Cup : tiger woods exacts some revenge in clinching win : A perfect 5 - 0-0 run to lead the you ...
lidong-train-3408,0,neg,charlie sheen,"I do hate charlie sheen , everybody hates him , he 's not funny at all ."
lidong-train-6035,1,neu,lindsay lohan,what are you so bitter about anyway ? and why are you swinging from lindsay lohan ' s sack ? just curious . .
lidong-train-651,2,neu,google wave,ten gadgets to make google wave more productive - and fun ! : by sebastian anthony ( rss feed ) nov 6th 2009 at 2:00 pm i . .
lidong-train-2155,3,neu,sarah palin,sarah palin IS A GREAT AMERICAN !!! She makes the Liberals nervous with Intelligence and Her Great POLICIES as a Conservative
lidong-train-4454,4,neu,harry potter,". . No , no , it 's perfectly normal to be in love with a harry potter actor at 23 . If you are an insane person ."
lidong-train-3088,5,neg,steve jobs,Look at it this way . At least it did n't go to steve jobs . fucking steve jobs .
lidong-train-2824,6,neg,george bush,i bet if george bush aka satan would got ta nobel peace prize nobody would been hatin ... yeah i said it ... * kanye style * lol
lidong-train-1078,7,neu,iphone,5 iphone accessories we 're still waiting for : along the same lines of the universal remote dongle above -- with . .
lidong-train-1486,8,neu,ipod,dead prez `` hip hop '' `` ipod reviews guide
lidong-train-5376,9,neg,taylor swift,The torture of listening to someones headphones blasting taylor swift has left a terrible earworm scar on this morning
lidong-train-3801,0,pos,google wave,"pulp fiction makes everything better , including google wave"
lidong-train-3740,1,neg,charlie sheen,Rebecca Black we do n't hate you because your famous ... your famous because we hate you ~ charlie sheen
lidong-train-2161,2,pos,kindle,i think the kindle is great . any time access to a huge selection of books ( cheaper than paper ones ) & perfect for travel !
lidong-train-4804,3,neg,martha stewart,My Bitch is Bad ! Like martha stewart when she was in Jail ThugLife BASED
lidong-train-4630,4,neu,bill gates,Is getting hacked off with wrkn all hours god sends & not getting any recognition 4 it from a certain somebody < -- bill gates ?
lidong-train-2695,5,neu,barack obama,Be careful the Ultraliberals along with barack obama are using an elution of HIR for more Social engendering Power & Larger Government HCR
lidong-test-232,6,neg,lakers,Fuck the lakers I 'm A TeamBrownskin Fan All The Way ; - )
lidong-train-644,7,neg,obama,President obama is looking gaunt ! Am not sure if it is because of d south American tour ! I doubt it ! The pressure of being president ! He has aged
lidong-train-4588,8,neg,sarah palin,Donald Trump found a level of crazy weird enough to knock sarah palin off the news cycle . - I 'm President Obama 's worst nightmare ! Really ?
lidong-train-4593,9,pos,lady gaga,Love lady gaga 's '' fashion '' and '' vanity '' songs !
lidong-train-5873,0,pos,ashton kutcher,What a cute movie ! ashton kutcher is too cute and Amanda Peet is gorgeous ! Ha its 7am . . Time for bed : s
lidong-train-5600,1,neg,obama,"obama - if you wan na fight , please take the lead . Do n't be a coward ."
lidong-train-3664,2,neg,taylor swift,I ca n't believe Miley said '' Curse you taylor swift and your bonus track '' on Hannah Montana . That 's just REALLY mean ...
lidong-train-4777,3,pos,lindsay lohan,david_brody i just got quoted by perezhilton wtf ? i feel like lindsay lohan !
lidong-train-5205,4,pos,ipad,"Love my new ipad . Great for work , fun and everything under the sun ."
lidong-train-1049,5,pos,miley cyrus,I do n't hate miley cyrus - _______ - and i love Hannah Montana .
lidong-test-333,6,pos,britney spears,okay i have 2 admit that '' 3 '' by britney spears - is kinda hot - catchy - after listening 2 it on repeat - it sticks in your head - go britney
lidong-train-3042,7,neu,wii,i love watching wedding slideshows and counting how many pictures were taken by me . ( four so far if you include a '' wii for wendetta '' framegrab . )
lidong-test-272,8,neg,micheal jackson,"fuck you micheal jackson , madonna is the best performance EVER ..."
lidong-train-5300,9,neg,john legend,"When I see ' john legend ' , on a song , I think ' Lennon ' . '' Why the fuck is John Lennon doing a song with Magnetic Man ?! '' . . I 've said that a lot"
lidong-train-6206,0,neu,lindsay lohan,lindsay lohan is back on the boys ! the mean girls star -- who had an extremely volatile on/off romance with dj s . .
lidong-train-5523,1,neu,madonna,Photo : madonna : What the hell is a disco stick ? Lady gag : I think you know . - Saturday Night Live ...
lidong-train-2441,2,pos,weird al,Jurrasic Park by weird al has to be on of my favorite songs of all time .
lidong-test-169,3,pos,britney spears,"no school today . ha . now im just jamming to britney spears . ugh , i love her . her musics legitimate , better than madonna ! muhaha"
lidong-train-3967,4,neu,ipad,Nunavut_Teacher kylepace Love my ipad but depends what you want . Wrote '' what 's working-what 's not '' blog ipad Ning site .
lidong-train-2833,5,pos,lady gaga,46 i love lady gaga ! 100factsaboutme
lidong-train-6134,6,neu,tiger woods,"tiger woods first sports player ever to be worth 1 billion , yes 1 billion $ . To play FUCKING golf !!?? Hey America Fuck your capitalism ."
lidong-train-1212,7,neg,windows 7,"that 's funny :) windows 7 still vulnerable to viruses -- durr , really ?"
lidong-train-4408,8,neg,soulja boy,my befriend just quoted soulja boy . fail !
lidong-train-1390,9,neu,psp,you make me feel like want to throw my psp away and buy a nds xddd * runs *
lidong-train-1961,0,pos,gaga,Outside in the rain waiting for gaga : o
lidong-train-4537,1,pos,kindle,"happy birthday ! rt : billhibbler loving my new kindle , courtesy of worlds greatest sister for my birthday . thanks mistykhan"
lidong-train-4316,2,neg,soulja boy,NP soulja boy - ( 1UP ) my utter-utter-utter Bullshit ... my ears are Bleeding .
lidong-train-465,3,pos,alicia keys,I need to get out to LA !!! All these Prince shows at the Forum are sounding amazing !! alicia keys and Prince singing a duet ! love it !
lidong-train-647,4,neu,lakers,DD9 is rocking ! I 've heard tons of great feedback from dealers ! The lakers are here and TheMirageLV is great !
lidong-train-789,5,pos,demi lovato,"'' While some Disney artists rely heavily on AutoTune and layers of effects , demi lovato sounds best with stripped-down production '' - Billboard"
lidong-train-3260,6,neg,donald trump,donald trump running for president is about as foolish ... & why the fuck do they want OBAMA to show his birth certificate . . shit is crazy
lidong-train-5957,7,pos,harry potter,JBieebersCTST . . it would it would lol ... I just seen the new harry potter movie . . Have you seen it yet . . It was amazing lol
lidong-train-5365,8,pos,psp,so the next lockerz restock is zlisters only then to normal members . i must get the psp then last chance before they raise ptz prices .
lidong-train-122,9,neu,jimmy carter,"on this day in 2002 , former president jimmy carter won the nobel peace prize . history"
lidong-train-4500,0,neg,taylor swift,"taylor swift was a FIVE SEED in the Esquire Sexy Bracket ??? DIE IN A FUCKING FIRE OF YOUR OWN BURNING , AWFUL , PUSSY LYRICS , BITCH ."
lidong-test-111,1,neu,ipod,totally managed to kill the right side of the audio on my ipod :( killed the left one on the old ipod ... yes im an apple product killer !
lidong-train-940,2,neg,ipad,renaissance _ Apple Survey - All Apple products Stink ? ipad sucks ? freebies .
lidong-train-1360,3,neg,lakers,"RT alvinthlang hellaspunky f you ! < - LOL there goes ONE of my MANY lakers haters , your queens are going down tonight , kay , thanksbye !"
lidong-train-14,4,neu,madonna,okay maybe just a little shocked xD omg nicolerichie the madonna fans are outraged at what you did
lidong-test-436,5,neg,google,"AND NOW FUCKING google WANTS MY PHONE NUMBER ! YOU WO N'T GET IT ,"
lidong-train-4501,6,pos,britney spears,"heaven on earth ~ britney spears x ] it 's the perfect song , for me ... d : - gasp - i 'm being concieded ."
lidong-train-4038,7,neu,jimmy carter,i love how the powderpuff media asks compelling questions . . you get jimmy carter in front of you and you do n't ask . .
lidong-train-301,8,pos,micheal jackson,is listening to micheal jackson album > 3 legends live for ever ! we love you micheal x
