id,fold,label,target,text
lidong-train-3770,9,neu,micheal jackson,"new videos on profile they are : micheal jackson , with friends , & latios so funny strong language so beware all you little ..."
lidong-train-269,0,pos,selena gomez,selena gomez = Singer ✔ Funny ✔ Actress ✔ Outgoing ✔ Beautiful ✔ Smart ✔ Laugh ✔ Smile ✔ Style ✔ Love towards her fans ✔ Fans love her ✔
lidong-train-1653,1,pos,ipod,"i 'm sooooooooooo bored . one has had ones ipod taken away :-( good bye my lover , good bye my friend !"
lidong-test-254,2,neu,lindsay lohan,top rated today : lindsay lohan ' s genius lips !!! - sexy stepfather & gossip girl threesome xoxo : . .
lidong-test-424,3,neg,barack obama,Can someone explain to me how the hell barack obama won a Nobel Peace Prize ? And for what exactly ? Maybe i 'll win one next year then ... . .
lidong-test-51,4,neu,alicia keys,Prince Brings Out alicia keys For '' How Come You Do n't Call Me '' Duet : If you did n't get anything good in your E ... .
lidong-train-2850,5,neu,bill gates,'' Be nice to nerds . Chances are you 'll end up working for one . '' ~ bill gates quote Awesome ... now I want a pocket protector
lidong-train-4857,6,pos,justin bieber,justin bieber 's the only person who can sound sexy reading directions off a Cup Of Noodles .
lidong-train-3794,7,neu,madonna,"I 'm pretty positive this sketching class is going to be my favorite . The teacher has worked with Michael Jackson , madonna , Miley , ect , ."
lidong-train-125,8,pos,britney spears,downloaded it . like it ! 4 record did n't like amy song britney spears & risque 3 ; to debut atop hot 100
lidong-train-2084,9,neg,paris hilton,"Willie Revillame & other celebrities , be like Justin Bieber & not like Charlie Sheen or paris hilton ! World has so many problems , do n't add !"
lidong-train-2200,0,neg,britney spears,i do n oh t wan na see britney spears sucking a penis . . ughh twitter get this spam shit under control . . thank you ! goodnight
lidong-train-4913,1,pos,google wave,checking out google wave ... looks pretty spectacular .
lidong-train-5047,2,neu,wii,i despise the wii . does n't catch the signals for guitar hero as well .
lidong-train-3124,3,neg,lady gaga,I apologize in advance BUT I find lady gaga sooo repulsive - .
lidong-train-1545,4,pos,britney spears,britney spears wan na go * -- * britneyspears amazing !!!
lidong-train-1233,5,pos,ipod,"is there a way when you ' list all songs ' on an ipod , it will group by album instead of alphabetically ? i should like such a feature"
lidong-train-15,6,neu,george bush,he might have got the nobel prize just for not being george bush
lidong-train-1873,7,pos,britney spears,man i love that new britney spears song ! loves it !!!!!!
lidong-train-4351,8,neu,google,Youtube is now going to transcode all new uploads in WebM format regardless of resolution . Great news ! . google
lidong-train-436,9,neg,john boehner,"john boehner , humiliation is what you feel when you fail yourself & shame is what you feel when you fail the people that trusted you . TCOT"
lidong-train-3194,0,neu,madonna,"Reviewing videos of madonna concert in Chili , the best experience of my life"
lidong-train-267,1,neu,lindsay lohan,emanuel ungaro and lindsay lohan : cut from the same cloth ? ( women 's wear daily ) - x.fr / ny9
lidong-train-3957,2,pos,mariah carey,"It 's not the worst duet that 's happened . mariah carey and Westlife , Green Day and U2 or Alexandra Burke and Pitbull take that accolade ."
lidong-train-5863,3,neu,harry potter,"okay , so . Upon reflexion , harry potter 6 was NOT good . But I still like it . Call me bipolar . : - P"
lidong-train-5811,4,neu,google wave,can i have a google wave invite please ? :) email : skuzzbucket hotmail.com
lidong-train-4478,5,neu,steve jobs,"Your work is going to fill a large part of your life & the only way to do great work is to love what you do , ~ steve jobs"
lidong-train-2779,6,neu,harry potter,this vampire craze is ridiculous . harry potter ftw .
lidong-train-2743,7,neu,google,"nowplaying '' google Me '' ~ Teyana Taylor ... AKA , the song I loved that everyone else hated ... . . lol ... '' google me baby ... '' lol !"
lidong-train-3034,8,neu,barack obama,ha . I love Patton Oswalt . He said barack obama is the name of a Jamba Juice supplement .
lidong-train-1991,9,neu,demi lovato,I liked a YouTube video -- Goodbye - JEMI ( demi lovato And Joe Jonas ) .
lidong-train-3072,0,neg,lindsay lohan,lindsay lohan is a disaster where can i find her and her exposed fanny ?
lidong-train-3364,1,neg,sarah palin,"Levi Johnson , father of sarah palin ' s grandson will pose nude in Playgirl . This guy is a real piece of work ."
lidong-train-1160,2,neg,lindsay lohan,"lindsay lohan is stealing again celebrity news , celebrity gossip ..."
lidong-train-5479,3,neu,hillary clinton,my respect for hillary clinton has rose like 100 % since she became second . of state .
lidong-train-5546,4,neu,bill gates,yeah then you 'd have to write bill gates a thank you card or something ...
lidong-test-432,5,neg,britney spears,that 's nasty lol it 's suppose to be britney spears lmao
lidong-train-4172,6,neg,micheal jackson,she got that good good . she micheal jackson bad bad .
lidong-train-5204,7,neg,snoop dogg,That stupid fucking beat is stuck in my head snoop dogg ft rosin boom the nut beat though I think that 's why it 's stuck in my head
lidong-train-1223,8,neu,lakers,I love NYC but how how can it not have a basketball team that make its name by itself ? That 's why I root 4 the The lakers !
lidong-train-361,9,pos,justin bieber,It 's so weird how Selena ca n't say : '' IM DATING justin bieber '' she makes it all complicated ... Ugh .
lidong-train-3599,0,neu,britney,"in other news , britney ALBUM TOMORROW britney ALBUM TOMORROW britney ALBUM TOMORROW britney ALBUM TOMORROW britney ALBUM TOMORROW britney"
lidong-train-4781,1,pos,britney spears,"In honor of Matthew 's birthday , we must all listen to Lady gag , britney spears and Lights , continuously ."
lidong-train-1419,2,neu,george bush,am happy the committee dint bestow the award on george bush !! ... though u never know what went backstage ; )
lidong-train-5412,3,neg,madonna,the name sounds a little more familiar now but damn he 's been passed around more than madonna
lidong-train-5410,4,neu,kindle,i am impulsively exploding my amazon wishlist and kindle '' save for later '' lists . somebody help ! i need a beer .
lidong-train-1678,5,neu,lindsay lohan,"you new hair style was a bigger scandal than when lindsay lohan did it ! , i swear !! you didnt wanted to dye your hair anymore ?"
lidong-train-800,6,neg,hillary clinton,"LankaWeb : Moral cries and lies of hillary clinton : H . L . D . Mahindapala On September 30 , 2009 , UN Secu . ."
lidong-train-2601,7,pos,micheal jackson,micheal jackson was loved to death -
lidong-train-2681,8,pos,kindle,"which horror/thiller book is a good read !? i 'm wishing for a kindle 2 , ah too hee hee . i 'm a dork ."
lidong-train-978,9,neu,britney spears,i love how britney spears ' s kids names are sean and jayden . familiaaarrrr x ]
lidong-train-5613,0,pos,britney spears,congratsbritneyyes indeed !! so excited and happy that she got up and got back into her career . good job love !! yay britney spears !!
lidong-train-3438,1,neu,jimmy carter,atlanta 's jimmy carter museum reopens after $ 10m renovation : totc_pop
lidong-train-1763,2,neu,psp,"ima muthafuckin monsta , bullshit me ? no , my hand game like a fucking psp"
lidong-train-1183,3,neu,xbox,xbox live : iamthebull5 is currently online . playing rock band 2 . guitar practicegetting ready to rock . ( xbox live nation )
lidong-train-3757,4,pos,britney spears,britney spears ! i love you
lidong-train-1823,5,neu,ipod,i 'm 98 % sure that my ipod touch is broken completely . but there is always that other 2 % .
lidong-train-3098,6,neu,joe biden,"joe biden just called George Bush 's house & screamed ' Mission Accomplished , Bee-yotch ! ' before quickly hanging up ."
lidong-train-5218,7,neu,harry potter,"Reading Goblet Of Fire while watching the harry potter movies again . . this is either going to get confusing , or make total sense"
lidong-train-6046,8,neu,harry potter,I thought you should 've sounded a little more like Hagrid from harry potter . experience
lidong-test-379,9,neu,tiger woods,Woods ensures victory for Americans : tiger woods delivered the clinching point on Sunday as the United States w . .
lidong-test-573,0,pos,charlie sheen,this guy looks like charlie sheen lol .
lidong-train-1158,1,neu,wii,cooda yay !! in bed tweeting rocks !!! thank you sooo much for fitting it ! - nice one cooda now get your wii online louvallis
lidong-train-24,2,neg,charlie sheen,FF MarkieAi Likes animals . Hates spiders . Hates charlie sheen . Likes cookies .
lidong-test-362,3,neu,madonna,thanks 4 haven me ; -RCB- ... ! itz always love when I come through . . I love your profile picture ! . Is that on madonna ' is booklet ?
lidong-train-2134,4,neu,harry potter,: he further added '' man i am amazed this craze was nt even for harry potter in India . am about to run out stock . letme order more ''
lidong-train-4962,5,neu,kindle,"of all the devices i 've coded for , the kindle is the most resistant to special ( and not even that special ) formatting ."
lidong-train-5995,6,neu,britney spears,"no you idiot ... :) the discussion was really boring , but laura did a good job as britney spears"
lidong-train-1956,7,neg,harry potter,Fuck harry potter ... . Fuck myers park ... . WeTheBoyz
lidong-train-6080,8,neg,justin timberlake,He 's gay ? He had a lot of girlfriends . He 's got no talent ? justin timberlake and Usher were fighting over him
lidong-train-2967,9,neu,lindsay lohan,"lindsay lohan to restrain dad '' celebrity gossip , news and ..."
lidong-train-4341,0,pos,harry potter,"Villains We Love : Lucius Malfoy - cinematic : I love the harry potter series ( books and movies ) , and I care ab . ."
lidong-train-1663,1,neu,britney spears,"the next person that follows me or sends me a message with porn using britney spears name , i will report you and rally hard against this ."
lidong-train-4731,2,neu,harry potter,We saw harry potter 6 !! the other movies are better though . :] now we 're just relaxing until cell groups !!
lidong-train-5810,3,neu,joe biden,joe biden ( 2007 ) thinks the President should be impeached for a war without asking Congress . Got ta love old videos . - .
lidong-test-175,4,neu,justin bieber,np justin bieber - One less Lonely Girl
lidong-test-667,5,neu,harry potter,Need another excuse to wear your harry potter costume ? Break it out again at CM 's Silver Scream Halloween Party
lidong-train-5070,6,neu,alex rodriguez,"Jonas - '' alex rodriguez '' : Ashton Kutcher has Punk 'd , and while that provided some entertainment , it 's gotten a ... ."
lidong-train-2333,7,pos,ipod,it 's like my ipod ' is stuck on replay .
lidong-test-641,8,pos,harry potter,Chelsealove95 read the harry potter books silly =] lol
lidong-train-4202,9,neu,google wave,"trying out google wave , pretty boring with no one you know on it !"
lidong-train-2146,0,neu,ipad,"Love VLC for ipad . I do n't have to convert videos . Just copy and paste and voilà I can watch movies , television series ."
lidong-train-5294,1,neu,lindsay lohan,superbuzzer : video : celebrity vanessa hudgens new personal nudes shots : celebrity lindsay lohan hard nipples pea . .
lidong-train-5731,2,neu,harry potter,watching harry potter ! And being goofy ! < 3 ha i know you love me = P
lidong-train-824,3,neg,stephen colbert,"Our podcast with billmckibben of 350 . org talks climate , Clean Air Act and why stephen colbert is a little scary : ."
lidong-train-1685,4,pos,windows 7,"liking windows 7 so far , installed today on work laptop"
lidong-train-333,5,pos,wii,at least you did n't hurt yourself playing the wii .
lidong-train-732,6,neg,martha stewart,I understand Julia Child is a legend right next to martha stewart but I ca n't stand to hear that bitch talk .
lidong-train-3327,7,neu,ipod,shutthefuckup if you a artist who disses a nigga you got on your ipod . . that 's not real
lidong-train-5309,8,pos,kim kardashian,"kim kardashian , Amber Rose and Rihanna have better bodies than Beyonce . Beyonce is thin . Ergh !"
lidong-train-737,9,pos,google wave,i would like to have a google wave invitation !
lidong-train-4267,0,neu,madonna,"As much as madonna disgusts me , the woman has good taste in boots ."
lidong-train-5110,1,neu,psp,battlefront - elite squadron for psp and ds
lidong-train-3225,2,pos,britney spears,listening to 3 by britney spears ! love the song ! congratulations britney it 's 1 ! yeah !
lidong-train-5560,3,neg,kindle,"foxit 's eslick reader now supports epub , puts kindle to shame hardware -"
lidong-train-3470,4,neu,britney spears,i 'm following britney spears from now on . i do n't give a damn about anything you say . ( :
lidong-train-544,5,neg,lindsay lohan,gross lindsay lohan ; even nastier looking than joan rivers
lidong-train-6091,6,neu,psp,playing gta liberty city story on the psp ! just killing people
lidong-train-1748,7,neg,justin bieber,"I just took '' SEASON 1 justin bieber is your Moms BestFr ... '' and got : Part 13 : If I 'm a Slut , then Your a Whore ! Try it : ."
lidong-train-1130,8,neu,britney spears,the unlikely tale of how britney spears got back on track after . .
lidong-train-3435,9,neu,lindsay lohan,"is lindsay getting fat : speaking of fatties , lindsay lohan took a break from doing nothing to go shopping yester . ."
lidong-train-352,0,neg,nicolas cage,"incidentally nicolas cage , i would blame your manager for your financial ruin , i 'd blame your bad acting and horrible choice of movies ."
lidong-train-795,1,neu,madonna,"lady gag and madonna were actually funny at snl , it surprised me lol"
lidong-train-2,2,neu,hilary swank,"wtf ? hilary swank is coming to my school today , just to chill . lol wow"
lidong-train-4669,3,pos,britney spears,mannequin - britney spears ( yall dnt know what this song does to me ! ) best song ever
lidong-test-361,4,pos,john mayer,"Ah , I love john mayer < 3"
lidong-train-54,5,neu,bill gates,I sure would love to meet the guy who created the first computer . . bill gates brother . . lol
lidong-test-435,6,neu,harry potter,well since you can walk through them like harry potter it would feel like anything ... and adrian258 showed me the storms co ...
lidong-train-4560,7,neg,khloe kardashian,khloe kardashian upset over weighty subject and Lamar Odom 's refusal to clean up : Respect the game ; respect your ... .
lidong-train-3779,8,neu,alicia keys,Listening to '' Like You 'll Never See Me Again '' by alicia keys - Never take a day with your loved ones 4 ( ... ) .
lidong-train-4098,9,neu,ipod,"lollypop man is on his jawbone , blackberry , got ipod earpiece in & its not how i remember lollypop men at school ! slightly surreal"
lidong-train-5564,0,neg,al gore,"in Poland , too ! Thanks to you know who to blame doctorfollowill it 's cold again . Damn you al gore for creating global warming ."
lidong-train-925,1,pos,google,RT newmediamike : Amazing List Of Every google Product And How Much We Depend On Them - . - not all was good
lidong-train-583,2,neu,charlie sheen,Kiss-Kiss : charlie sheen bei Jimmy Kimmels Talkshow .
lidong-train-5591,3,neu,barack obama,Poll : Public split on health overhaul legislation : Opposition to President barack obama ' is hea . .
lidong-train-145,4,pos,google,I love google ! as a whole with all its services
lidong-train-1559,5,neu,madonna,madonna is amazing guys ! Revolver
lidong-train-2570,6,neu,madonna,"Do I have to change my name , will it get me far , should I loose some weight , am I gon na be a star madonna ' sSongLyrics"
lidong-train-1295,7,neu,kindle,some interesting feedback on the kindle in a class context :
lidong-train-2338,8,neu,britney spears,3 britney 3 3 3 brit brit drunk bruyney britney 3212u33t10 britney britney 357456 is ogb britney gay boy britney spears 3 ...
lidong-train-4392,9,neg,lakers,RT Sheila_So_Sexy : RT tastemypussy Who 's watching the sorry lakers play 2nite ? < -- FUCK the lakers !!! If you not a Heat Fan ... StabY ...
lidong-train-1022,0,neu,ashton kutcher,ashton kutcher Chilling with LB .
lidong-train-5459,1,neu,sarah palin,"Today , sarah palin recommended this book on her facebook page ."
lidong-train-5152,2,neg,britney spears,yo just got that '' britney spears sucking a cock '' follower . . heard that shit spam so about to block it
lidong-train-569,3,pos,ipod,just finding my ipod i lost it for like a month so i 'm happy
lidong-train-199,4,neu,windows 7,the upgrade version of windows 7 lets one move from any properly licensed version of windows experience or vista to windows 7 on that same computer
lidong-train-2933,5,pos,harry potter,"man i always love harry potter weekend on abc family . See britt_alexander , what your missing out on !"
lidong-train-5194,6,neu,hillary clinton,And perhaps hillary clinton is also getting tired of the Israeli governments attempts 2portray them as anti-Israel despite all she has done ?
lidong-train-1939,7,neu,maradona,buen suerte argentinatours I am rooting for you . After living in BA 2 months I tend to support Diego maradona and co .
lidong-train-2373,8,pos,iphone,iphone iphone iphone ! they 're awesome : )
lidong-train-4136,9,neg,nicolas cage,nicolas cage is not responsible for his financial irresponsibility : when it comes to taking the blame for his reply . .
lidong-train-364,0,neg,charlie sheen,BREAKING NEWS ! Actor charlie sheen and R&B king R Kelly got into a fight and R kelly was arrested for ( continued ) .
lidong-train-2163,1,neu,iphone,i get an error on iphone when trying to watch : try yfrog .
lidong-train-2062,2,neu,lindsay lohan,lindsay lohan debut collection as a fashion designer is a disaster
lidong-train-3203,3,neu,steve jobs,"The Gulfstream has been the alpha-male plane of choice for celebrities like steve jobs , Tom Cruise or John Travolta ."
lidong-train-5073,4,pos,google,The world is full of interesting things - awesome collection from tomux at google Creative Lab : . via BBHLabs
lidong-train-5080,5,neg,britney spears,lmao ! what a freak man . no one wants to watch britney spears suck penis . xd
lidong-train-5653,6,pos,sarah palin,"The Mary Kay women here in Idaho are a lot like sarah palin . They have a pioneer spirit t -- t hey hunt , fish , & are very entrepreneurial-minded"
lidong-train-4737,7,pos,iphone,i love the image stabilization in camera genius for iphone . tells me i 'm the one seeing blurry . check please !
lidong-train-2040,8,neg,ipad,So jesus hates my ipad eh . Ugh ... Where am I ? What 's happening to me ? Reality seems somehow unreal . My Lord . Frontierville is NOT REAL ?
lidong-train-5187,9,neu,iphone,"i 'm grateful for the little things today , like that my windshield wipers work most of the time , and that my iphone wasnt stolen last night"
lidong-train-2279,0,neu,madonna,is anyone else made really uncomfortable by madonna ' is thrusting on the video Celebration ? Like seeing your granny fiddle with herself .
lidong-train-2052,1,neg,katy perry,These kids are cracking me up ! ( katy perry 's Firework -- new video ) .
lidong-test-171,2,neu,wii,better now . with in town watching that mjackson movie . i have wii bluray and television all to myself . oh . what to do first ?
lidong-train-1480,3,neg,nick jonas,and they were tryna kill us all and everyone was like shit run ! then it went normal again : L and nick jonas was sitting on a chair all sad
lidong-train-3221,4,pos,britney spears,britney spears is an underrate musical genius
lidong-train-161,5,pos,lady gaga,gagafanforever8 ahh ... you love lady gaga
lidong-train-1834,6,neu,steve jobs,乔布斯搞主题公园啦 ! -- steve jobs to help Disney turn stores into mini theme parks |
lidong-train-4623,7,neu,kindle,i 've used a kindle only a bit and found its navigation far from simple . kindle book prices are outrageous too !
lidong-train-3511,8,neu,ipod,just wanted to let you know that i just got home to find my roommate blasting '' home life '' on my ipod speaker ! love that song !!
lidong-train-2081,9,pos,britney spears,'' 123 '' by britney spears is a good song . i did n't know it was by here until this morning . it 's on again .
lidong-train-1903,0,neu,steve jobs,Watching and learning from this GuyKawasaki How to present like steve jobs
lidong-train-2703,1,neu,google wave,"so , as it turns out , google wave invites are n't really '' invites '' , per say . they 're more like nominations and then google decides who gets them"
lidong-train-2494,2,neu,ipod,put my music in yo ipod i guarantee you wont be disappointed
lidong-train-3984,3,neg,oprah winfrey,"Every time I randomly watch oprah winfrey on television , I ca n't help but wonder , how the fuck has this idiot been on nationally for 25 years ?"
lidong-train-1327,4,neu,psp,monster hunter freedom unite usa demo psp bahamutwwwtorrentsforall ...
lidong-train-4075,5,neu,madonna,HungUp time goes by . so slowly . time goes by . so slowly . for those who wait . madonna
lidong-train-2793,6,pos,psp,consider it done ! im in a good mood ! :) plus i see that philly ! psp all day !
lidong-train-4187,7,neu,barack obama,Obama condemns ' outrageous ' violence in Syria \ n ( AFP ) \ n : AFP - US President barack obama condemned Syria 's ... .
lidong-train-1105,8,pos,windows 7,amazing clock for windows 7
lidong-train-3877,9,pos,madonna,I 'm going to tell you about love madonna
lidong-train-5778,0,neu,jimmy carter,do your jimmy carter impression brah
lidong-train-5833,1,pos,ipod,i love you little pink ipod . i 'll never leave you alone again !!!!!!!!
lidong-train-4369,2,pos,lakers,Shout out 2 lakers follow back if you love the lakers like we do
lidong-train-5551,3,neu,madonna,WOOOOW !! Lady gag on SNL was AMAZING !!! The skits was funny 2 !! esp . the one with madonna & gag together !!!
lidong-train-3288,4,neg,george bush,george bush didnt do shit . . liberate who ? that was just a facade to the shit he made when he ran over to iraq ... icing to cover an ugly cake
lidong-train-5124,5,neg,lindsay lohan,freaky friday is onnnnnnnn !!!!!! i fucking love this movie !!!! lindsay lohan and tienna are the shit in this band !!
lidong-train-6054,6,neu,psp,"btw , my friend ewanspence over at the podcast network just released his latest the psp show podcast with his review of the psp go ! listen !"
lidong-train-6034,7,neu,hilary swank,hilary swank & richard gere as an screen romantic couple ? that 's a little terrifying ! amelia comes out this friday ? oscar-time already ?
lidong-train-1448,8,neg,google wave,google wave is really silly when you have no invites and like 3 people to talk to lol .
lidong-train-5829,9,pos,britney spears,britney spears 3 please
lidong-train-4345,0,pos,hillary clinton,hillary clinton hails special relationship - Times Online : Telegraph . co . hillary clinton hails special relationshipTime
lidong-train-17,1,pos,britney spears,tomorrow we have art class ! love it ! lsning to britney spears - piece of me
lidong-train-2742,2,neu,charlie sheen,[ Dutch ] Vegazz : charlie sheen : Bieber 's Never Say Never has beat Michael Jackson 's ... : Vegazz : charlie sheen ... . MJ
lidong-train-2239,3,neu,ipad,LovePor_LS Ju_mmarinho demorei gente ?? srsrrsrs poxa ja to ipad ninguem mereçe
lidong-train-3112,4,neg,lady gaga,lady gaga called Rebecca Black a genius . . I lost a little bit of respect for mother monster for that comment .
lidong-train-3576,5,neg,demi lovato,LOL ! In youtube are so mandy do n't hate demi lovato vieos . . i 'm asking me why cause just a few people are hating her like every star : D
lidong-test-86,6,neu,harry potter,what is the best harry potter movie for you ?
lidong-train-4243,7,neu,xbox,interesting . the ps3 does n't restrict hd upgrades ( does n't even void warranty ) & allows the use of external usb hds too ! better than xbox !
lidong-train-4201,8,pos,harry potter,MrElliotB harry potter ? deathly hallows . just saw the movie an it was awesome !
lidong-train-1244,9,neg,windows 7,my 1st experience connecting windows 7 to a wireless network . doesnt work . is it time to switch everyone over to mac ? yes
lidong-train-72,0,neg,lady gaga,Photo : lovelyasadove : I do n't like lady gaga at all ! She is a true devilworshiper ! I just do n't like her ! I 'm ... .
lidong-train-3430,1,neu,windows 7,dell order still in production status . :\ but something . was already delivered : '' easy transfer cable for windows 7 '' what is this supposed to be ?
lidong-train-2007,2,neu,ipad,Lord_Sugar just got your book for the ipad . Loving the childhood stories . Especially the one about reply cycling wooden road foundations !
lidong-train-1206,3,neu,charlie sheen,"charlie sheen dumps literary agent : charlie sheen has parted ways with his literary agent , Peter McGuigan at Fou ... ... ."
lidong-train-5468,4,neg,shakira,Sorry ... but I do NOT want to listen to Katy Perry and shakira while I eat my sushi .
lidong-train-5475,5,neu,psp,officialstreetradio.com presents : djnophrillz world recognition v5 . its official !!! phree download psp !!!
lidong-train-3580,6,neg,perez hilton,i love how joejonas is always nice to people even though they talk shit about them . like perez hilton .
lidong-train-608,7,neg,obama,"Mad Magazine-B4 Jackson , there never was a Prez born west of Appalachia , before obama , there had never been a Prez born , wherever he was born"
lidong-train-1670,8,neu,psp,"i once had a 4 monitor setup with a portable dvd player and my psp and ds , you have much to learn ."
lidong-train-6070,9,neu,madonna,- that lady sure is gag ! I ♥ ladygaga did you see her & madonna on SNL last night ?! CLASSIC : )
