id,fold,label,target,text
lidong-train-3726,8,neu,ipad,Via MikeAllen 's morning Playbook : '' Obama says he does not have an ipad . ' I have an iReggie . ' '' Love it . ( Get it ? LOVE it ? Crack myself up )
lidong-train-443,9,neu,madonna,irado !!! madonna - Celebration ( Felguk love Remix ) : : : : : Released today on Amazon.com ! : )
lidong-train-1721,0,pos,britney spears,got ta admit that the justice remix of '' me against the music - britney spears '' is awesome : p
lidong-train-672,1,neg,harry potter,RT Kissin_InDaRain I hate when 25days of Christmas plays harry potter -_-
lidong-train-2350,2,neu,hillary clinton,Clinton warning to Afghan leader - BBC News Straits Times Clinton warning to Afghan leaderBBC news Secretary of State hillary clinton . .
lidong-train-3062,3,neu,britney spears,laying on my sofa and listening to '' toxic '' by britney spears . another boring day . nothing to do . .
lidong-train-2128,4,neg,britney spears,"i do n't appreciate this britney spears character with her profile picture sucking on a pee n'tis , following me ."
lidong-train-5195,5,neu,ipod,i have mark_salling 's glee tribute song in my head . i want this on my ipod ...
lidong-train-2918,6,neu,britney spears,oh sara bareilles music is cool . do you like miley cyrus and britney spears ?
lidong-train-2717,7,pos,gaga,gaga is looking great in those pictures !
lidong-train-4586,8,neu,barack obama,barack obama Says He 's Keeping His Nobel Peace Prize as He Wages ... .
lidong-train-5307,9,neu,madonna,FF kflosworld because she can sing like madonna . ( I hear she 's good ) & she keeps it 100 and will tell you if you 're jank . & ilher ! ( :
lidong-train-1503,0,neu,nicolas cage,the bad lieutenant : port of call new orleans : nicolas cage plays a rogue detective who is as devoted to his job . .
lidong-train-3040,1,neg,obama,"obama is a real risk taker , pussy put all 1 seeds in the final for his bracket"
lidong-train-3971,2,neu,barack obama,Obama : ' we stopped massacre in Libya ' \ n ( AFP ) \ n : AFP - A defiant President barack obama told Americans he had stopped a '' massacre ...
lidong-train-2254,3,neu,wii,"new post : wii sports surpasses 50m units , new super mario brothers . nears 20m - gamasutra ("
lidong-train-3544,4,neg,britney spears,"why , were you listening to britney spears and you are worried you coffee is going to taste like shit ?"
lidong-train-1923,5,neu,britney spears,okay i was n't cracking & you was watching he-man and gi joe square ! you know as much as britney spears about hiphop . i am king
lidong-train-3299,6,neu,barack obama,"How barack obama could help redeem the Nobel Committee 's grievous mistake , by Peggynoonannyc -"
lidong-train-3279,7,neu,iphone,bell canada is coming out with the iphone tom ! this means lowered plans hopefully from rogers !
lidong-test-328,8,neg,lady gaga,Tryna get a wawa not a lady gaga .
lidong-train-5696,9,neg,charlie sheen,I think you should all just assume you have cervical cancer and let us use the $ for tax cuts for charlie sheen .
lidong-train-39,0,neu,britney spears,i love bad romance and fashion and 3 by britney spears i love you both lady gag too girl ! her concerts r better than the record !!
lidong-test-127,1,neu,kindle,beginning the great kindle experiment ... wish me luck . although i 'm not sure if i want it to be good or not .
lidong-train-3560,2,neg,britney spears,"michael jackson , kate gosselin , sarah palin , bernie madoff , lady gag , & britney spears are the most popular halloween costumes ."
lidong-train-5916,3,neg,madonna,"I believe in you like , a virgin ; you 're madonna , and i 'm always gon na want to blow your mind ."
lidong-train-4600,4,neg,lindsay lohan,lindsay lohan use to look fucking hot circa mean girls now she 's just a fucking mess imjustsayin
lidong-train-3843,5,neu,lindsay lohan,celebitchy : lindsay lohan posts more desperate tweets to samantha ronson
lidong-train-5415,6,neu,justin bieber,Walked into my brothers room to find justin bieber playing . : |
lidong-train-1677,7,pos,ipod,"duo for my ipod is awesome facebook and twitter same time plus its better than tweetdeck , most of all it was free !!!!!!"
lidong-train-1312,8,neg,madonna,madonna is an idiot and way past her material girl phase . She is annoying and all her songs sound the same . just not cool anymore . Give up !
lidong-train-5769,9,pos,lady gaga,"i love this child , she is amazing !!!! lady gaga - Born This Way ( Cover ) . via youtube"
lidong-train-2819,0,neu,kindle,on a kindle you can not highlight or mark text in a pdf . just tried it . you can only bookmark a page and go back to it .
lidong-train-1620,1,neg,google,Could anyone tell me ... WHY THE FUCK MY google IS N'T REGISTERING MY PASSWORD ?!
lidong-test-433,2,pos,lady gaga,"Quality night , amazing costumes but got ta say lady gaga was the best though . . poor gaga left shoes and phone in my car ha"
lidong-train-3502,3,neu,britney spears,john and edward + britney spears song = cringe . :| olly is the best so far ! and joe : )
lidong-train-3384,4,neg,windows 7,"sony help to upgrade tz series to windows 7 seems very limited and with risk . '' buy your own , do it yourself , do n't call us if it goes wrong ''"
lidong-test-683,5,neu,britney spears,britney spears wins best celeb mom ... in other news : michael jackson wins most healthy and active pop singer ...
lidong-train-3046,6,neu,barack obama,"Israpundit '' Blog Archive '' barack obama Kow-Tows to China over Tibet : We read that barack obama , in deference . ."
lidong-train-957,7,pos,wii,we both know i need the exercise !!! but wii is fun as hell for real . i even got kristian trying to bowl
lidong-test-2,8,neu,google wave,"received my google wave account today ! sorry have no invites , but i will spread the love if i receive any , thanks twitter community !"
lidong-train-5318,9,neu,iphone,"realtore i doubt i 'll post public nz pictures , but i was impressed . & no edits . ladies & gentlemen-the iphone ."
lidong-train-2720,0,neg,google,"Eer come on google , stop fucking me around ."
lidong-train-675,1,neu,harry potter,is watching harry potter . I love that the television knows what I want . :) ...
lidong-test-672,2,neg,jimmy carter,rt : linuxgal jimmy carter is no longer the country 's worst president ! tcot
lidong-train-871,3,neu,snoop dogg,NP This Weed Is Mine - snoop dogg Feat . Wiz Khalifa
lidong-train-5596,4,neg,micheal jackson,"She got that good good , she micheal jackson bad I 'm attracted to her with her attractive ass ! > Now your a rapper"
lidong-train-4552,5,neg,britney spears,"musicology 187 - when you beat a dead horse , you ca n't complain when it starts to smell like britney spears - ..."
lidong-train-5990,6,neu,harry potter,harry potter taking 2 long with these damn movies weoffthat
lidong-train-1289,7,pos,justin bieber,Key has been listening to justin bieber 's songs recently . divafacts
lidong-train-1123,8,neu,britney spears,"2009 hottest artists ft . flo rida , katy perry , britney spears , lady gag together -"
lidong-test-483,9,neu,ipod,finally put that michael jackson this is it on my ipod love that song
lidong-train-3807,0,neu,miley cyrus,miley cyrus Gets Back Into Music and Twitter : .
lidong-train-239,1,neu,windows 7,"i can get ubuntu 9.10 for free , and it 's better than windows 7 anyway !"
lidong-train-5449,2,pos,lindsay lohan,i 'm in love with lindsay lohan ...
lidong-train-1430,3,neu,britney spears,"support support britney spears sbs , add a twibbon to your avatar now ! -"
lidong-train-5262,4,neu,lindsay lohan,lindsay lohan has blasted reports of another jewelry scandal
lidong-train-5176,5,neg,obama,"The longer the obama administration wears on , the more i like bill clinton"
lidong-train-859,6,neu,lindsay lohan,when you compare lindsay lohan pre and post cocaine - her looks have improved . if you like that look .
lidong-test-661,7,pos,miley cyrus,"miley cyrus was the revelation of millions of teenagers , being Hannah Montana . It ` s not about how she is ' cause in the end she needs respect"
lidong-train-4164,8,neg,ipad,i want a fucking ipad bitch acquiredtaste
lidong-train-4037,9,pos,kindle,"friends & strangers , i have purchased a kindle . i shall review its performance for your convenience in the near future ..."
lidong-train-4116,0,neg,madonna,YAY !! madonna 1 on the World Chart and 1 on the European Hot 100 Chart !! Go on with your bad self ! ; )
lidong-train-2014,1,neu,lindsay lohan,lindsay lohan tweets sam ronson heartbreak -
lidong-train-6041,2,pos,harry potter,"ChangminFacts yes , i would , we 'll go to hogwarts school because both of us loves harry potter xD"
lidong-train-5474,3,neu,iphone,do you have eliminate professional ? on your iphone ?
lidong-train-3790,4,neu,bill gates,'' Your most unhappy customers are your greatest source of learning . '' ~ bill gates
lidong-train-2414,5,neu,steve jobs,"thank you , apple & steve jobs , for all the trouble you put people through JUST dealing with your proprietary inventions . why did i need an pod ?"
lidong-train-778,6,neu,britney spears,"lucunya : britney spears went to a resto , someone near her farted , everyone was staring & angrily she responded '' oops i did it again ''"
lidong-train-1330,7,neu,maradona,Diego maradona denies that he 's a quitter
lidong-train-2757,8,pos,ipad,Love my ipad : RT USATODAYmoney : High hopes for ipad push Apple shares near $ 300 .
lidong-train-3710,9,neu,harry potter,I just watch harry potter for the accents suckerforbritishaccents fb
lidong-train-2301,0,pos,britney spears,S&M by Rihanna and britney spears is real awesome
lidong-train-933,1,pos,kim kardashian,Great news NUX fans ! We have extended our giveaway of kim kardashian 's NUX USA jacket to give you more time to ... .
lidong-train-1664,2,neg,windows 7,i think hell has frozen over ... i 've installed windows 7 ... ku0dm
lidong-train-4718,3,neu,kindle,international kindle is good ( and about time ) but i heard it is not good for technical books . waiting for the quereader .
lidong-train-2982,4,neu,ipod,"for all the itunes trouble you ran into trying to get songs from the ipod to your pc , shout for sharepod . link :"
lidong-train-3391,5,neu,ipad,"Amazing World Heritage Site photo : . . I discovered it on Fotopedia Heritage , a free ipad application . ."
lidong-train-1066,6,neu,iphone,pulled tweetdeck : slight problem with the new iphone tweetdeck v 1.1 - works 4 most but crashes 4 some
lidong-train-1778,7,neu,hillary clinton,Funny ! BONK BONK BONK BONK ( That 's the sound I imagine hillary clinton ' is head made banging against the wall this morning . )
lidong-train-3938,8,neu,tiger woods,Tiger will make it tough - Monty : Colin montgomery believes tiger woods ' presence would make it '' a better win '' . .
lidong-train-3865,9,pos,britney spears,delayedtweets britney spears has a new song called womanizer . i hope it becomes popular
lidong-train-2843,0,neu,windows 7,no ! i use windows 7 but i still prefer to use my mac ... : )
lidong-train-2036,1,neg,kindle,"dude , i totally want a b & n nook . hate the look of kindle and the sony reader is crap . finally an reader that looks worth the $"
lidong-test-182,2,neu,bill gates,The homie Trey is hustlin bacwards ... bill gates would never start an Apple trending topic ... any pub is good pub
lidong-train-4769,3,pos,britney spears,"so lazy listen music of britney spears , lady gag pink , katy perry i love they music this girls are wonderful !! thanks for your music"
lidong-train-3002,4,neu,lindsay lohan,"deathdani in the house . welcome to the twam man ! hope you like doritos , lindsay lohan , and diapered giraffes ."
lidong-train-5952,5,neg,britney spears,"britney spears is stuck in my mind ! its that damn song , '' 3 . '' too catchy to get out of my head . britneyspears"
lidong-train-1159,6,neu,maradona,Now maradona ' is men need a result in Uruguay on Wednesday . He may yet get out of this mess he 's created
lidong-train-1380,7,neg,shakira,Beyonce & shakira in the Beautiful Liar video are just ridiculous . . No need to be that hot !
lidong-train-1936,8,neg,obama,Why is obama 's foreign policy backing the same people as Al Qaida in Libya ? . via AddToAny
lidong-train-1366,9,neu,britney spears,"one two three , i like two weiners in me -- devon uy after hearing britney spears latest chart topping hit ."
lidong-train-6058,0,neu,madonna,"Debi Mazar was more glamorous than her buddy madonna THEN . She was exotic . NOW , madonna is the glamorous 1 & the super famous 1 . love her dialect"
lidong-train-4525,1,pos,lady gaga,RT : sincerelyjaylyn embrcthemartian : Sooo my mom loves lady gaga very weak / / dont be a hater / / iwas very thinking of you when she said that
lidong-test-531,2,neu,sarah palin,sarah palin can spell Afghanistan ? I think that 's the real shocker .
lidong-train-798,3,neu,snoop dogg,Iremember when my dad and brother went too a snoop dogg concert and me and my sister went too and that 's when I got on my1st rollercoaster lol
lidong-train-4789,4,pos,barack obama,barack obama should definitely get his own gold coin .
lidong-train-3490,5,neu,psp,"oh and greig off flat a got robbed the other day aswell , laptop , phone , wallet and psp all gone . he managed to block his new bank card"
lidong-train-219,6,neu,ipod,am not sure if trey songz video is going to make it to television . . like wow ! ( it will make it to my ipod though lol )
lidong-train-509,7,pos,britney spears,i love britney spears ' new song ' till the world ends ' i think thats what its called lol .
lidong-train-4953,8,pos,kindle,ilol . i do like the look of the kindle . i want it for reading reports and articles in pdf .
lidong-train-689,9,pos,wii,setting up our new wii and getting ready foe some cowboy 's football !
lidong-test-82,0,neu,kindle,thank you ! wescky do you have the new kindle ? what do you think about it ?
lidong-train-3908,1,neg,justin bieber,"I ca n't believe , girls are too stupid , they are going to protest in downtown the 30th of april . Why ??? To bring justin bieber to lebanon !"
lidong-train-2183,2,neu,lindsay lohan,"lindsay lohan ' s proud ( ha ! ) papa , michael lohan , told radar that lindsay is addicted to prescription pills ."
lidong-train-2966,3,neu,taylor swift,"i 'm having so much fun with this doesfollow.com website . hehehe . did you know that taylor swift follows nick jonas , but not joe jonas ? trolol"
lidong-train-5517,4,pos,justin timberlake,"Well I 'd like four different 6 ' dildo 's . Named Chris , Leo , justin timberlake & Rob ."
lidong-train-3853,5,pos,britney spears,"taylor swift 's acceptance speech , beyonce letting taylor swift having a moment and finishing her speech , britney spears won all three vmas"
lidong-train-2073,6,pos,madonna,"'' pink elephants and lemonade , dear jessie hear the laughter running through the love parade '' I LOVE madonna ♥ . . until late 90 's that is ."
lidong-train-2565,7,pos,google,"Okay , google television sounds awesome , but I dunno if I want google as my main information platform . I heart google , but I heart choice even more"
lidong-train-5667,8,neu,britney spears,if you follow me it will make my year . you are following britney spears ! i at least have your albums . what do you say ??? please ?
lidong-train-1197,9,pos,nick jonas,"Jesus Christ people , nick jonas cut his hair cause he felt like it . Besides , his hair looks 10x better and he looks so much more ... grown ( ;"
lidong-train-3692,0,neg,ryan seacrest,I fucking hate ryan seacrest . ( I do n't even know if I spelled the bitches name right . )
lidong-train-5745,1,pos,lakers,citybndinmydrms I hate the suns so I would go to the game as a knicks fan but I 'm a lakers fun so I definitely wan na go to a K vs L game
lidong-test-658,2,neu,harry potter,at least I can say that I 'm not a twilighter . Gim me harry potter anyday .
lidong-train-388,3,neg,john boehner,john boehner needs not look like he is going to cry at any minute then maybe I could respect him a bit more that and if he would do his job
lidong-train-1843,4,neu,madonna,"madonna tetep energetic yeah , see on Celebration music video ."
lidong-test-527,5,neu,jimmy carter,rules for nobel peace prize also say a former winner can nominate someone . perhaps jimmy carter ?
lidong-test-277,6,pos,ipod,rocking out on the bus . i love my ipod .
lidong-train-472,7,neg,ipad,nickspurway Apple Survey - What is your opinion of Apple Products ? ipad sucks ? freebies .
lidong-train-3193,8,pos,kindle,i just ordered my kindle . now i 'm fluctuating between excitement and omg i just blew a lot of money on a kindle .
lidong-train-1257,9,pos,obama,I hope Belgium does n't piss obama off ... I like Belgium .
lidong-train-1680,0,neg,john boehner,"If john boehner & Harry Reid can come to a budget compromise , the NFL players ' union and owners really do n't have an excuse . Imjustsaying"
lidong-train-5813,1,pos,justin bieber,Taylor Swift & & justin bieber are really good friends :) SwiftConnect
lidong-test-382,2,neu,lakers,OH MY FUCKING GOSH ARE YOU FUCKING KIDDING ME ?! lakers GAME WHILE I HAVE PRACTICE . FUCK MY LIFE .
lidong-train-5129,3,pos,barack obama,congratulations to barack obama - Nobel Peace Prize . Wow .
lidong-train-5937,4,pos,britney spears,"saturday , song of the week :3 - britney spears . she 's nice , she signed all those fan mail , and within 2 months :) what a beautiful singer she is :"
lidong-train-2575,5,neu,britney spears,kris allen does britney spears - the hollywood gossip
lidong-train-2232,6,neg,lakers,DJHOMICIDE1 Haa me & the lakers arrogance have a love/hate relationship . Hows the album coming out homay
lidong-train-2283,7,neu,kindle,seriously considering to order a kindle . i rather want to go for a nook but that 's for us citizens only : - (
lidong-train-929,8,pos,ellen degeneres,ellen degeneres Deemed Trustworthy for Jodi Picoult 's Fifth Film Adaptation .
lidong-train-2482,9,neu,lindsay lohan,btw lindsay lohan keeps tweeting samantha ronson about their failed r/s and samantha refuses to reply . i actually feel damn bad for lindsay .
lidong-train-4740,0,neg,obama,Senate Isakson : obama policies fuel higher gas prices . Politics
lidong-test-616,1,neg,lakers,If you 're that fragile I 'd prefer you do RT mrgambinii : Is no longer following LiLiAN_C33 : RT PlayWitMyMonkey : FUCK The lakers YeahISaidIt
lidong-train-3743,2,neu,britney spears,so like im fucking trippin out because i just realized i love britney spears ... lmao damn im woohoo .
lidong-train-1156,3,neg,john legend,john legend Is ' Rolling ' In The Struggle : I 'm so very conflicted about john legend 's cover of Adele 's '' Rolling i ... .
lidong-train-2059,4,neu,lady gaga,Gente vota no coverama Banda lady gaga Cover ! .
lidong-train-2560,5,neg,lindsay lohan,estrella archs does n't do a bad job designing without lindsay lohan - new york magazine
lidong-train-121,6,pos,tiger woods,misskish0h9 BarOfTheDay : my motto get money that 's it/mastering the green game like tiger woods an ...
lidong-train-3340,7,neg,lady gaga,"TheLandPirate yeah mufucka , fuck a lady gaga , I 'll freestyle on All these white girls , we keep it nasty"
lidong-train-5556,8,neg,psp,grand tourismo for psp i fucking dope .
lidong-train-997,9,pos,chelsea handler,Trying to sleep but chelsea handler got me rolling ... Lololol !
lidong-train-299,0,neu,kindle,"well i checked it out in consumer reports ( my dad subscribes ) and they say go with the kindle , so i 'll probably do that . thanks for tips : )"
lidong-train-2132,1,neg,joe biden,DTN Libya Unrest : Video : Could Obama be Impeached over Libya ? Let 's ask Biden : By Vice President joe biden 's own ... .
lidong-train-5141,2,pos,justin timberlake,"He had both Usher and justin timberlake clamoring to sign him , and after signing with Usher 's label , now counts the ... ."
lidong-train-3775,3,neu,barack obama,Waitrose dumps Fox News in protest over remarks on barack obama
lidong-train-3440,4,neg,hillary clinton,noneck davidstevenBREAKING NEWS Obamas Nobel prize . Turns out it was awarded for making peace with hillary clinton .
lidong-train-5623,5,neu,sarah palin,( NY Politisite ) -- sarah palin urges troop buildup in Afghanistan : Former Republican vice pre . .
lidong-train-2082,6,neu,lindsay lohan,watching freaky friday right now and is there anything better than vintage lindsay lohan ? i think not . mom if you have a bnk stmt of mine
lidong-test-262,7,neu,sarah palin,On sarah palin ' s book '' Going Rogue '' is that like going commando ? nounderwear
lidong-train-5637,8,pos,xbox,"whatever , i was hoping for at least some xbox points"
lidong-train-4426,9,neu,kindle,wah ! did n't get your pretty summer cover on my kindle . fun2 finally have covers in my office
lidong-train-3803,0,neu,harry potter,Am watching harry potter and the Sorcerer 's Stone . They looked so young and innocent then .
lidong-train-73,1,pos,google wave,"do n't know if anyone is doing it , but google wave seems to be a good place for newsrooms to collaborate in real-time for elections ."
lidong-train-495,2,neu,perez hilton,perez hilton - Daniel Radcliffe Admires Lady GaGa 's Gay Rights Advocacy .
lidong-train-624,3,neg,windows 7,"those using windows 7 on laptops , you need to consider aerofoil to help prevent battery life :"
lidong-train-530,4,neu,harry potter,a gorgeous ginger headed boy who loves harry potter ?
lidong-train-5908,5,neg,taylor swift,This insane new video of taylor swift is just too sexy . .
lidong-train-676,6,neg,soulja boy,Girls wet like they living in a fish tank ? Lmao really soulja boy
lidong-train-5658,7,neu,wii,"fils-aime : new super mario brothers . wii will outsell mw2 -- with one stipulation [ claims ] : that stipulation is , it 'll b ..."
lidong-train-5154,8,neu,lindsay lohan,how to look like a victoria 's secret supermodel with lindsay lohan
lidong-train-806,9,neu,lindsay lohan,lindsay lohan : fendi boots fierce ( just jared ) - x.fr / y5t
lidong-train-2160,0,neg,weird al yankovic,( You just don FUCK with Weird Al-MS ) The weird al yankovic gag Parody Dispute . via tbithewire
lidong-train-1421,1,pos,tiger woods,"Grassroots to strike gold : The backing of the world 's top players - most notably tiger woods , of course - has b . ."
lidong-train-3870,2,neu,anderson cooper,"So sick of Donald Trump . I enjoy how he thinks he knows everything yet when anderson cooper proves him wrong , his response is '' yeah whatever ''"
lidong-train-3096,3,neg,obama,"obama Agency Review Looks To Snip The Red Tape : By all accounts , the government does n't operate very efficiently with ... ."
lidong-train-5524,4,neg,lindsay lohan,"lindsay lohan sucks at fashion , employment : bad business decisions are made all the time , but honestly , signing . ."
lidong-train-1319,5,neu,xbox,xbox live : mr kami is currently online . joinable - playing call of duty 4 . playing domination on ambush . ( xbox live nation )
lidong-train-741,6,pos,britney spears,"britney spears 3 is my new favorite song , and oh yeah i miss you lils xxxx"
lidong-train-3202,7,neu,jimmy carter,"the poll sucks anyways , obama won it just like jimmy carter won it!they 'll always b haters , infact they 've been since the start of the world"
lidong-train-5031,8,neu,charlie sheen,"ever Longoria is no TEN | Ayyyy ! : April 8 , 2011 in Ayyyy ! , babies , Booze , Breaking Up , Britney Spears , charlie sheen , ."
lidong-train-5325,9,pos,lady gaga,"favorite lady gaga quote ? :) -- i love every word she says but i have to pick '' Some women choose to follow men , an ... ."
lidong-test-108,0,neg,paris hilton,Even more so than paris hilton being racist in her video - it chills me to the bone when she makes fun of people for being '' poor . '' She sucks .
lidong-train-3562,1,neu,madonna,kj mullins madonna Wins In Leaked Wedding Picture Case : madonna ' is charity will be getting a large chu . .
lidong-train-4166,2,neu,sarah palin,Agreed . But the sarah palin stuff was kind of funny . As was the '' What 's THAT bitch talking about ? '' sketch last year .
lidong-train-758,3,neu,britney spears,britney spears and lady gag album releases in the same month - i cant handle it !
lidong-test-462,4,neu,lindsay lohan,lindsay lohan was involved ? so i 'm guessing the serial killer won .
lidong-train-326,5,neu,alicia keys,NEW Video '' Unthinkable '' by Porta_Rich_ITD ft alicia keys -- > . Youtube
lidong-train-6132,6,neg,john boehner,When see john boehner 's face on television I want to smack the shit out of it . But since I can barely afford the television I have I will refrain . Maddow
lidong-train-215,7,neu,iphone,iphone under attack from android invasion - pc world
lidong-train-876,8,neg,obama,"your partner cheats , blame obama . your kid fails a test in school , blame obama . your girl is pregnant , not the father ? Just blame obama"
lidong-train-6063,9,neu,bill gates,bill gates is a Scorpio sweet like rock Kandy
lidong-train-1516,0,neg,harry potter,best harry potter moment ever was when that nosy fleabag journalist got caught in that jar < - no argument
lidong-train-5719,1,neu,wii,yes th jerk and my brother play 1 . wii so i can twitter with you guys longer year !
lidong-train-3448,2,neg,ashley tisdale,Mr. ashley tisdale scary guy fu and where they came together Sneem only suited her Zac Efron at the place they are perfect couple
lidong-train-3689,3,pos,windows 7,shiny new notebook !! i love windows 7
lidong-train-2705,4,pos,psp,playing spyro the dragon on psp . i still love it !
lidong-test-89,5,pos,google,"Hey google , thanks for all these great Labs features on Chromium , but how about '' Create Application Shortcut '' ?! ."
lidong-train-1780,6,neg,harry potter,Whoops forgot I don give a fuck about harry potter what the fuck am I doing
lidong-train-1538,7,neu,steve jobs,What do mac have against hyphens ? Did one abuse steve jobs as a child
