id,fold,label,target,text
lidong-train-181,8,pos,taylorswift,oh justinbieber and taylorswift are in the same country ?? : o that 's amazing ! I wish I were british ... ha
lidong-train-655,9,neu,wii,beautiful day here in fwb ! on the couch watching the magic game ! go magic ! and just remembered my parents have a wii -- im very excited : )
lidong-train-325,0,pos,britney spears,"3 by britney spears , my most played for these past two days ! feels like d-d-dancing !"
lidong-train-1385,1,pos,barack obama,Cigar Mr President ? Cuba 's Fidel Castro hails barack obama ' is Nobel peace prize - Telegraph
lidong-train-4441,2,pos,britney spears,photos from the gorgeous britney spears ' set of the '' 3 '' music video :
lidong-test-54,3,neu,nicolas cage,virile heavenly host nicolas cage
lidong-train-6051,4,neu,jimmy carter,"nobel peace prize always been a bit of a joke . it 's been given to a number of shady characters , like yassir arafat & jimmy carter ."
lidong-train-5826,5,neu,psp,"the way you talking to me few minutes ago is like if i do n't let you play my psp , then block me"
lidong-test-238,6,neu,lady gaga,"lady gaga : ' I do n't feel like a superstar ' : By Kate Goodacre , News Subeditor lady gaga has revealed that she sti ... ."
lidong-train-318,7,neu,nicolas cage,revealed . . nicolas cage ' s secret passion -
lidong-train-3631,8,neu,britney spears,now shes singing me hannah montana . and toxic by britney spears . im so serenad . but the best one was jason mraz im yours .
lidong-train-183,9,neu,google wave,i 've been surfing the google wave lately . i had high hopes but they have been dashed . perhaps it will redeem itself . googlewave
lidong-train-5052,0,neg,lakers,"yeah boy !!! RT Michael_JCox : Btw , lakers . lakerhaterandproudofit ."
lidong-train-1354,1,neu,sarah palin,'' Obama deserves the Nobel prize for the simple reason that if it were n't for him sarah palin would be in the White House . ''
lidong-train-1038,2,neu,madonna,Warner to begin selling advertising across the web in music videos by artists like madonna
lidong-train-1426,3,neu,britney spears,ha no way . i 've seen britney spears . she 's way better than snakes !
lidong-train-2453,4,pos,miley cyrus,Selena Gomez is beautiful . miley cyrus is cool . Demi Lovato is a strong girl ever . Justin Bieber is an inspiration . I am a person who love them .
lidong-train-5305,5,pos,alicia keys,I love that alicia keys song
lidong-train-5426,6,neu,madonna,madonna HEARTBEAT i love it !
lidong-train-745,7,pos,harry potter,my stepdad loves harry potter now . he wins at life .
lidong-train-1413,8,pos,windows 7,i really like windows 7 !
lidong-train-903,9,neu,john mccain,":) Courage is not the absence of fear , but the capacity to act despite our fears . john mccain"
lidong-train-3195,0,neu,windows 7,"i am a pc guy , but the mac commercials are sooo much better than the windows 7 ( or any microsoft ) commercials . always very funny and on point ."
lidong-train-339,1,neu,xbox,xbox live : sleepy not dead is currently online . playing last.fm . listening to music . ( xbox live nation )
lidong-train-4109,2,pos,britney spears,. britney spears ' gorgeous beauty and fiery sex appeal are entirely unparalleled ! ( continued ) .
lidong-train-4683,3,neu,iphone,i think it is a big deal for former iphone users . i like the zoom buttons that go away with inactivity .
lidong-train-3399,4,neu,sarah palin,"from mk : Tank better cover Levi 's nuts all times , because ' sarah palin is going 2 try 2 shoot them from her plane when she watches this shit ."
lidong-train-1013,5,pos,kim kardashian,'' Red Light Special '' still makes me want to go all kim kardashian on somebody like I should be working a corner on Harry Hines .
lidong-train-3338,6,neu,lindsay lohan,"saw pictures of lindsay lohan from her shopping in nyc , looks like she 's getting fat or ran out of coke ? paris drug dealers would n't front her ."
lidong-train-3232,7,neg,harry potter,"sleep at a time like this ? during the fucking harry potter marathon on abc family ? NO WAY , JOSE ."
lidong-train-5834,8,neu,jimmy carter,the new jimmy carter ? : i saw this billboard in nj last weekend : how long will democrats be able to hang with around . .
lidong-train-3426,9,neu,nicolas cage,lady in his next movie & nicolas cage is selling another castle ! wow he has a catsle . britney 's single `` 3 '' hits number 1 . ( dailyfill.com )
lidong-test-332,0,neg,taylor swift,who told taylor swift it was okay to dance like that in those covergirl commercials ? because that 's a pretty funny joke ... notafan
lidong-train-5471,1,neu,sarah palin,Just recalled how many times she got told she looks like a much hotter version of sarah palin last night bahaha
lidong-train-2469,2,pos,lindsay lohan,the photo is the lindsay lohan of the song bossy the song is very good
lidong-train-5057,3,pos,justin bieber,I 'LL deathmatch justin bieber 20 TIMES FOR YOU WHEN HE COMES ONLINE IF YOU GO FOLLOW iBieberRoses iBieberRoses iBieberRoses I PROMISE :) 4
lidong-train-5138,4,neu,mandy moore,"The making-of feature is led by mandy moore and Zachary Levi and basically plays like a Disney Channel aside , but I ... ."
lidong-train-2640,5,neg,khloe kardashian,I think I have to follow khloe kardashian on Mondays so the bitch do n't flood my timeline with '' khlomar '' propaganda . Shiiiizah .
lidong-train-4227,6,neu,hillary clinton,"I like jo , hillary clinton , and Leighton Meester 's style ."
lidong-train-2334,7,neu,lindsay lohan,... did silencefound seriously say that sam ronson is most famous for '' turning lindsay lohan gay '' ? are you serious with this ?
lidong-train-2090,8,neu,john boehner,"High atop the Capitol dome , john boehner huddles inside a crude nest of Senate resolutions and human hair . duringthegovernmentshutdown"
lidong-train-6025,9,pos,demi lovato,100FactsAboutMe 5 . i love selena gomez-nick jonas-joe jonas - kevin jonas - taylor swift - demi lovato & miley
lidong-train-2402,0,neu,madonna,true that souljahboy n much luv.dd yeah . will guyz hear about the cat fight of madonna n lady gag . what is the problem ?
lidong-train-2263,1,neu,lindsay lohan,did lindsay lohan steal jewels during paris fashion week ? : ungaro creative consultant lindsay lohan is slamming . .
lidong-train-505,2,pos,iphone,need a new iphone case . ifrogz one was too flimsy afterall
lidong-train-5283,3,neu,xbox,death of the xbox . r.i.p
lidong-train-3093,4,pos,nick jonas,"Miley has called nick jonas : '' My Sweet inspiration '' , '' My Love '' , '' Prince Charming '' , and '' Nicky '' . RT if that made you smile : )"
lidong-train-4520,5,neg,lindsay lohan,dina lohan `` begging '' lindsay 's friends to help her : lindsay lohan ' s life is on a downward spiral . let & 82 . .
lidong-train-3136,6,neg,lindsay lohan,"made a yummy spagettie bolenaise for dinna and now im watching labor pains , it has lindsay lohan in it , its kinda funny = ]"
lidong-train-3128,7,neg,google,"Dear google Chrome , Your a penis and i hate you :) Kthanksbye"
lidong-train-954,8,neu,britney spears,"megan fox fears no longer get on a plane thanks to britney spears , because she hears one of her songs when she is in a plane ."
lidong-train-5850,9,neu,google,rawker28 Oh thank you ... Good morning ! The newspapers on my google home page were all at about 7 or 8 so that 's great to hear !!
lidong-train-4337,0,pos,katy perry,infect me with your love and fill me with your poison . eek ! i love katy perry so much :) ) )
lidong-train-5494,1,neu,harry potter,RelleGuapo smh ... negative . i will stay awake all night watching harry potter . twilight isnt all that great .
lidong-train-4951,2,neu,lindsay lohan,lindsay lohan slam jewel theft accusation
lidong-train-3568,3,neg,weird al,At kid 's talent show instead of seeing weird al talk about his book . Sitting in Satan section though I doubt I will need to shout it .
lidong-train-1608,4,neg,micheal jackson,"she got that good good , she micheal jackson bad , im attracted to her , with her attractive ass ... oooo that is the song man !"
lidong-train-2080,5,neg,iphone,"multi-level funny - very annoying that iphone corrects '' says '' to '' sex . '' fail to catch , and i send goofy message . or worse ."
lidong-train-1302,6,neu,britney spears,is britney spears planning a mexican wedding ? : pop princess britney spears is causing rumors to emerge that she . .
lidong-train-1240,7,neg,lindsay lohan,may be it 's a damn parent trap ( hell no you 're making a movie with lindsay lohan ) huahahahahahaha
lidong-train-3086,8,neu,google wave,"i have 8 google wave invites ! best replies get them . [ you going to post the best replies , sam ? ]"
lidong-train-3401,9,pos,google wave,got my google wave invite today . pretty neat-o . ca n't wait to see it on android .
lidong-train-2576,0,neg,weird al yankovic,"It 's a weird feeling , having Bob Seger 's ' Like A Rock ' and weird al yankovic 's ' Weasel Stomping Day ' stuck in your head at the same time ."
lidong-train-5742,1,neu,xbox,there is n't a damned thing free on the xbox : d
lidong-train-4652,2,neg,madonna,"I watched your Letterman appearance with madonna today on You TubeNobody does that anymore , everyone 's so well behaved shame"
lidong-train-1236,3,neg,madonna,watching ESPN bashing WNBA finals . . to myself lol . Manly-ass arms . . and I thought madonna ' is was worse
lidong-train-1885,4,pos,steve jobs,Present like steve jobs
lidong-train-3149,5,pos,hilary swank,congratulations to hilary swank ! the actress was honored by the hollywood film festival . what 's your favorite swank role ?
lidong-train-2256,6,neg,sarah palin,It would be lost on her . Dear sarah palin : Watch Shepard Smith if you want to see what going rogue really looks like .
lidong-train-3970,7,neu,madonna,"I 've got it - they 're like a mixture of madonna , Kylie , and Peter Andre , trying to be MGMT . Horror ."
lidong-train-773,8,pos,justin bieber,Omg !! that song right next 2 u by justin bieber & chris brown is the bomb I love that song !!! : )
lidong-train-3126,9,neu,britney spears,britney spears & lady gag monster ( official song ) 2009 : author : mrmusicalbum ke . .
lidong-train-5828,0,neg,charlie sheen,"33 . I 'm tired of hearing about charlie sheen , I act crazy all the time . Where 's my money ?!"
lidong-test-177,1,pos,britney spears,'' three '' is the new song by britney spears and i love it !
lidong-train-4111,2,neu,lindsay lohan,the emperor 's old clothes in defense of lindsay lohan ' s at ungaro
lidong-train-4433,3,pos,google,RT Matt_Muir : This is fucking wonderful . Great presentation from google containing the best online creative of the year : . ...
lidong-train-762,4,neu,kindle,"is n't the kindle inspiration enough ? mind you , i 'd be okay with them with or without the kindle present . : )"
lidong-train-5755,5,neu,madonna,inspiring meeting at the National Gallery with their chief scientist including rare insight into Raphael 's madonna of the Pinks
lidong-train-5367,6,neu,george bush,i am also not george bush . can i have a nobel peace prize now ?
lidong-train-3573,7,pos,nicolas cage,"just watched face off . love john travolta and nicolas cage in this movie ! john t , you can do more than dance ."
lidong-train-4440,8,neg,al gore,Cool It ( 2010 ) A reasonable and intelligent alternative to al gore 's exaggerations . 7/9
lidong-train-2997,9,pos,taylor swift,"Selena likes Justin 's eyes , Miley likes his smile , taylor swift likes his hair but Beliebers , Beliebers like Justin , as himself . < 3"
lidong-train-345,0,pos,ipod,damn i really need a itouch ... or ipod in general
lidong-train-5202,1,neu,nicolas cage,movie star ' led down path to financial ruin ' : oscar-winner nicolas cage is suing his former business manager for . .
lidong-train-1014,2,neu,madonna,"It felt right & madonna told me to do it , apparently is n't a valid excuse for anything . Except stealing Malawian babies & making bad movies"
lidong-test-48,3,neg,britney spears,britney spears new song is about a threesome . but its 2 guys one girl ? i believe that 's called a gangbang . dirty britney .
lidong-train-905,4,pos,google wave,learning about google wave . really excited for it . work will be much better when these types of tools are commonplace .
lidong-train-2767,5,neu,windows 7,"promo 50 gigs storage , $ 50/yr personal storage backup , works on windows 7 / xp/vista . backup before upgrade save time ."
lidong-train-865,6,pos,dave matthews,"Video : Mike Doughty : Tremendous Brunettes Mike Doughty with dave matthews , This make smile and think about ... ."
lidong-train-631,7,neu,psp,"i preordered lbp psp already - getting a sackboy keyring : doh , congratz on the crown , you deserve it ; )"
lidong-train-2678,8,neu,bill gates,bill gates : How I 'm trying to change the world now ( includes the infamous mosquito release ! )
lidong-train-1146,9,neu,xbox,thinks twitter and facebook on xbox live is going to boost the little controller keyboard sells .
lidong-test-348,0,neg,miley cyrus,"18 ) Taylor Swift , miley cyrus , Kristen Stewart , Justin Bieber and Demi Lovato annoy me . 100FactsAboutMe"
lidong-train-3802,1,neu,google,"empireofthekop Ironically enough , one of the google ads in your sponsor pane was '' New Razor by Gillette . '' ;-) Great news !!! ynwa"
lidong-train-3336,2,neg,nicolas cage,nicolas cage sure doesnt like to pay taxes . earlier this year it was revealed that the star owed the government $ 6.26 million in back taxes .
lidong-train-5858,3,neu,steve jobs,And He has a vision too ! mirzan mahatir is looking like steve jobs right now .
lidong-train-5201,4,pos,lady gaga,GirlieMayJones i like lady gaga and iam glad that she was featured in android CM her pictures are all over tokyo ... love it
lidong-train-712,5,neg,britney spears,hwahhh ??? wacky brits ... britney spears voted best celebrity mum
lidong-train-2609,6,pos,lindsay lohan,i love lindsay lohan .
lidong-train-3892,7,neg,britney spears,"it 's britney , bitch ! : i was pulled to a britney spears concert for my beloved girlfriend . the things i do for he . ."
lidong-train-2495,8,neu,madonna,okay as a courtney fabulous it might be SLIGHTLY sacrelige but i 'll be honest i like madonna ' is music ... cant help it
lidong-train-1819,9,neu,iphone,losemynumber if you think the blackberry storm is better than iphone ...
lidong-train-878,0,neu,madonna,"I bought an old madonna LP the other day for . 99 , I 'm gon na clear $ 10 after fees ."
lidong-train-1251,1,neu,nicolas cage,real estate news | nicolas cage ' s ' treasure ' buried in debt : `` levin . .
lidong-train-5260,2,neg,paris hilton,West Indies are going down quicker than paris hilton did in that hotel room cwc2011
lidong-train-5782,3,neu,britney spears,estou ouvindo : brave new girl - britney spears
lidong-train-573,4,pos,windows 7,i love windows 7 its so nice lucid was right
lidong-test-293,5,pos,windows 7,"been playing with windows 7 a bit , i must say i 'm not disappointed yet . though i 've seen some nifty os x like ui design along the way . ."
lidong-test-143,6,neu,harry potter,At first glance I thought you said harry potter would sleep well tonight ! Phils win ! Harry Reese will sleep sound tonight .
lidong-train-2673,7,pos,jimmy carter,he is in great company of people like jimmy carter . nice
lidong-train-5781,8,pos,justin bieber,Hello people love you justin bieber xx
lidong-train-1870,9,neu,sarah palin,sarah palin ' s popularity bothers social liberals
lidong-train-3465,0,pos,google wave,working with google wave robot tweety . really interesting stuff .
lidong-train-4981,1,pos,rev run,rev run & Diggy Simmons : Generation RUN Video : Generation RUN : Hip-hop pioneer rev run and his son Diggy discu ... .
lidong-train-3704,2,neg,sarah palin,"In order to cure the stupidity that had infected their country after sarah palin visited , India needed BillGates ' visit as an antidote ."
lidong-test-681,3,pos,harry potter,harry potter was so epic/funny/awesome ~
lidong-test-219,4,neu,barack obama,So the dem fight terrorism do they ? -- barack obama : Taliban can be involved in Afghanistan future
lidong-test-582,5,neu,xbox,xbox live : fgomn is currently online . playing bioshock . building a bomb to smash the doors of the evil andrew ryan . . ( xbox live nation )
lidong-train-2366,6,neu,sarah palin,"sarah palin , 09.10 . today showed decrease of preferences"
lidong-train-4017,7,pos,britney,FFFFF '' I wan na go '' and '' Till The Worlds Ends '' by britney makes me wan na freaking stand up and dance ! Damn !
lidong-train-248,8,neg,obama,"I grew up as a Democrat . Thank God ! , I learned what was real . Do n't think I am completely biased . There are some good dem , but not obama ."
lidong-train-1609,9,pos,windows 7,installed windows 7 on my tp ... running smooth so far ... pretty impressed with a microsoft product after a long time !!
lidong-train-3992,0,neg,britney spears,why do i kp gttng these nasty britney spears dng nasty things people following me i have no desire 2 see her do anything sexual i do n't like blonds
lidong-train-525,1,pos,mandy moore,"TeamFollowBack mandy moore : Protect Your Pets ! : mandy moore cuddles a puppy as she helps launch PetArmor , the A ... ."
lidong-train-270,2,neu,wii,my plan on watching videos of the new super mario brothers . game for the wii has been spoiled by grad students with scholarship questions .
lidong-train-176,3,neg,hilary swank,hilary swank : i let boyfriend 's son see me nude : but her revelation that she goes nude in real life -- in fro . .
lidong-train-6024,4,neg,harry potter,i hate harry potter weekend
lidong-train-1966,5,neu,obama,"obama : the softly-softly president - Was he late to interfere in Libya ? I don THINK SO , LET US BE ! . via Telegraph"
lidong-train-3835,6,neu,psp,twitter is acting stupid on my psp ... not cool ...
lidong-test-266,7,neu,harry potter,"watching harry potter 1 ! omg , he looks so young and adorable compared to now . now hes just old and grody :P getting dressed to do something , ily ! < 3"
lidong-train-571,8,neu,paris hilton,paris hilton denies racism allegations - Digital Spy .
lidong-train-6214,9,neu,madonna,"Whoops , missed the last tweet . I quite like the queen and eminem ... madonna on the other hand ..."
lidong-train-1282,0,neu,barack obama,"barack obama was born in hawaii , not flipping africa . i do n't care if you like him , but he was n't born in africa ."
lidong-train-863,1,neu,sarah palin,Levi Johnston Has Turned Stripper : The whole sarah palin phenomena has become the joke that just wo n't go . .
lidong-train-4867,2,neu,wii,"wii fit plus , huh ? how the hell are kids supposed to get ripped with this tripe . the collector 's edition better come with horse steroids ..."
lidong-train-948,3,neg,lady gaga,"How I 'm Gon na Tell My Baby Bye Bye , Outfit Look Crazy On You You My lady gaga !"
lidong-train-5629,4,pos,nicolas cage,"war , inc . was good . if you liked it , you 'll also like '' lord of war '' with nicolas cage ..."
lidong-train-432,5,neg,nicki minaj,i think Trina 's badder than nicki minaj and DEFINITELY badder than little kim . Trina 's ACTUALLY really pretty .
lidong-train-2567,6,neu,lindsay lohan,tehe lindsay lohan kiss tehe ... * prepares himself for the face punch ''
lidong-train-185,7,pos,wii,good list ! i love my wii fit : )
lidong-train-4693,8,pos,wii,cant believe how unfit i am ... so glad i got a wii fit : d
lidong-train-5400,9,neg,nick jonas,okay . Joe Jonas and nick jonas = FUCKING HOT SHIT .
lidong-train-353,0,pos,oprah,Love the shows oprah comes up with !! Such an inspiration !
lidong-train-4998,1,neu,lindsay lohan,'' what were they thinking ? '' analysts say lindsay lohan ' s widely panned designs for luxury label ungaro may spell . .
lidong-train-927,2,neu,sarah palin,Geez ! sarah palin ' s life just plays out like a South Park episode does n't it ? Here 's the latest :
lidong-train-5927,3,neu,britney spears,britney spears voted best celebrity mom ! = angelina + jolie
lidong-test-140,4,neg,britney spears,"just saw those annoying twins do britney spears on the x factors ... so so painful , it 's like watching a car crash !"
lidong-train-250,5,neu,ipod,"i want to get a mp3 player for chelsea . we had an ipod , but she had some difficulty figuring out how to use it . thinking about ..."
lidong-train-710,6,neu,alicia keys,Good news : We 're spared an alicia keys . Potentially less good news : Sonia Rao 2.0 is singing Adele . Good news : She 's okay ! TheVoice
lidong-train-10,7,neu,hillary clinton,"people whose reactions I 'd appreciate this morning : bill clinton 's , hillary clinton ' is ... george bush 's ( latter for completely difference reasons )"
lidong-train-5469,8,pos,miley cyrus,miley cyrus and Nick Jonas perfectcouple
lidong-train-5528,9,neg,harry potter,"harry potter is a really shit ! I 'm so sorry , I tried it too much . but it 's impossible , I do n't like it !"
lidong-train-3593,0,pos,britney spears,listeningto 3 - britney spears :) it 's amazing : dd
lidong-train-2268,1,neg,lakers,RT KingDTay : The lakers suck !!!!
lidong-train-5421,2,pos,miley cyrus,"This might sound dirty , but im just patiently waiting for the miley cyrus sex tape ... lol u know its bound to happen"
lidong-test-160,3,neg,russell brand,russell brand is an annoying little FUCK who should be deported and never allowed to return to America rustyrockets
lidong-train-4746,4,neu,psp,just won a psn redemption code for a mclaren slr limited edition red for gran turismo psp woohoo ! fb
lidong-train-1571,5,neu,harry potter,The problem with harry potter | Arts diary
lidong-train-727,6,neu,tiger woods,"Wow , I 'm freeeeeaaaking tired . tiger woods 9-12pm :-) and a good long nap is in store to prepare me for some birthday celebration ! woohoo 23 !"
lidong-test-540,7,neg,nicki minaj,hey guess what HATERS you CAN KILL YO SELF * nicki minaj voice * lol
lidong-train-351,8,neu,britney spears,check this video out -- sweet dreams britney spears interlude
lidong-train-6019,9,neu,ipod,"got it worked out . every teen with faithful attendance & completion of the online bible study , will get an ipod touch . details this sunday ."
lidong-train-4929,0,pos,britney spears,at last ! i already have britney spears ' new single '' 3 '' in my pod and i 'm listening to it now :) i like it !
lidong-train-5083,1,neu,windows 7,how to protect the launch of windows 7 using a usb flash drive
lidong-train-5838,2,neu,kindle,"holy buckets-goodbye kindle , hello nook ! color screen , notetaking ability , easier to read . * eeek ! * my bookshelf begs me"
lidong-train-6136,3,neg,sarah palin,"no sarah palin masks , shockingly"
lidong-train-2711,4,neu,tiger woods,finished my programming assignment ! tiger woods fist pump ... just like last week too . hahaha
lidong-train-1029,5,pos,britney spears,"im blasting 3 by britney spears into my ears ... wow seriously its super high quality , super clear & really addictive !"
lidong-train-3274,6,neu,ipod,seeing beyonce in 11 days ! super excited ! would be cool if i had phone & could twitpic from concert but ipod touch decides against cameras >_>
lidong-train-5255,7,neu,john mccain,"We are taught to understand , correctly , that courage is not the absence of fear , but the capacity for action despite our fears . john mccain"
lidong-train-3581,8,pos,justin bieber,sexy !!! jaja I love you with all my heart justin bieber ♥ ♥ .
lidong-train-1578,9,neu,nicolas cage,nicholas cage hates uncle sam : the irs has placed a tax lien on nicolas cage ' s real estate holdings ... .
lidong-train-3344,0,neg,obama,"Hmm , so they sent Joe to camp to keep him from clearing up Team obama 's Libya mission problem : ( continued ) ."
lidong-train-2077,1,pos,demi lovato,I will never understand how people can hate demi lovato . It 's like hating the biggest sweetheart in this world .
lidong-train-315,2,neu,britney spears,"do any of my followers have a picture of britney spears performing live ? just had an idea for my uni course but need a fresh photo , deathmatch me !"
lidong-test-398,3,neu,psp,"install has gone okay , a few bubbles . edges are quite difficult on psp go but got there in the end"
lidong-train-3989,4,pos,alicia keys,Speechless by alicia keys and Devil In A New Dress by Kanye just played back to back on my shuffle ... thought that was cool . . lol
lidong-train-4558,5,neu,xbox,lesson learned today : tiger woods on the xbox is way easier than golf in real life .
lidong-train-5815,6,neu,google,Android = fragmentation . awesome pie chart with 16m colors amateurs at google
lidong-train-930,7,neu,lindsay lohan,"'' lindsay lohan hits rock bottom '' screams tabloid . err , really ?! thank you like rpulse truth"
lidong-train-5976,8,neg,madonna,ive had the misfortune of meeting madonna she is such a stuck up bitch ! ♥ d when met you at expo ldn ages ago though cme back to ldn . x
lidong-test-458,9,neu,google,"google ha , you fucking with yeah prep rally today ??"
lidong-train-2872,0,neg,nicolas cage,nicolas cage owes $ 6mm in back taxes . looks like he 's going to have to go out and do another one of those awful movies
lidong-train-138,1,neu,kindle,"i know it 's anecdotal , but the kindle application , stanza and classics are some of the most popular apps i see"
lidong-train-1068,2,neg,barack obama,"barack obama 's FATHER , also named Barack , was born in Kenya , NOT PRESIDENT Barack . GET YOUR FUCKING FACTS RIGHT . ( :D )"
lidong-train-1676,3,neg,joe biden,joe biden is ruining days all over UNH RT : realpod45 the tech place just said my laptop is completely broken ... I blame joe biden
lidong-train-1987,4,neu,khloe kardashian,"'' necolebitchie : nikki Minaj , Britney Spears , khloe kardashian & More Hang out Factory Night Club '' < -- how I WISH I was there !!!!!!!!!"
